Name,Session,ID,URL,Dataset,Domain,Language(s),Main metric,Other metrics,Multilingual?,Fairness or bias?,Efficiency?,Interpretability?
Investigating label suggestions for opinion mining in German Covid-19 social media,1A: Computational Social Science and Cultural Analytics #1,long.1,https://aclanthology.org/2021.acl-long.1,German COVID-19 tweets,Twitter,German,"Accuracy, F1",Inter-annotator agreement,0,0,0,0
How Did This Get Funded?! Automatically Identifying Quirky Scientific Achievements,1A: Computational Social Science and Cultural Analytics #2,long.2,https://aclanthology.org/2021.acl-long.2,Funny scientific papers,Scientific papers,English,Accuracy,,0,0,0,1
Engage the Public: Poll Question Generation for Social Media Posts,1A: Computational Social Science and Cultural Analytics #3,long.3,https://aclanthology.org/2021.acl-long.3,Social media polls,Sina Weibo,Chinese,"ROUGE, BLEU",,0,0,0,0
HateCheck: Functional Tests for Hate Speech Detection Models,1A: Computational Social Science and Cultural Analytics #4,long.4,https://aclanthology.org/2021.acl-long.4,Hate speech tests,Templated tests,English,Accuracy,,0,1,0,0
Unified Dual-view Cognitive Model for Interpretable Claim Verification,1A: Computational Social Science and Cultural Analytics #5,long.5,https://aclanthology.org/2021.acl-long.5,"Snopes, Politifact, FEVER",News claims,English,"Accuracy, F1",,0,0,0,1
Catchphrase: Automatic Detection of Cultural References,1A: Computational Social Science and Cultural Analytics #6,short.1,https://aclanthology.org/2021.acl-short.1,Pop-culture quote usages,Reddit,English,Accuracy,,0,0,0,0
DeepRapper: Neural Rap Generation with Rhyme and Rhythm Modeling,1B: Language Generation #1,long.6,https://aclanthology.org/2021.acl-long.6,,,Chinese,Perplexity,Accuracy,0,0,0,0
PENS: A Dataset and Generic Framework for Personalized News Headline Generation,1B: Language Generation #2,long.7,https://aclanthology.org/2021.acl-long.7,,,English,AUR,"MRR, ROUGE",0,0,0,0
Enhancing Content Preservation in Text Style Transfer Using Reverse Attention and Conditional Layer Normalization,1B: Language Generation #3,long.8,https://aclanthology.org/2021.acl-long.8,,,English,Accuracy,BERT Score,0,0,0,0
Mention Flags (MF): Constraining Transformer-based Text Generators,1B: Language Generation #4,long.9,https://aclanthology.org/2021.acl-long.9,,,English,CIDEr,"SPICE, BLEU",0,0,1,0
Generalising Multilingual Concept-to-Text NLG with Language Agnostic Delexicalisation,1B: Language Generation #5,long.10,https://aclanthology.org/2021.acl-long.10,,,Multiple (5),BLEU,"METEOR, TER",1,0,0,0
On Training Instance Selection for Few-Shot Neural Text Generation,1B: Language Generation #6,short.2,https://aclanthology.org/2021.acl-short.2,,,English,BLEU,,0,0,0,0
Conversations Are Not Flat: Modeling the Dynamic Information Flow across Dialogue Utterances,1C: Dialog and Interactive Systems #1,long.11,https://aclanthology.org/2021.acl-long.11,,,English,"BLEU, METEOR, NIST",,0,0,0,0
Dual Slot Selector via Local Reliability Verification for Dialogue State Tracking,1C: Dialog and Interactive Systems #2,long.12,https://aclanthology.org/2021.acl-long.12,,,English,Accuracy,,0,0,0,0
Transferable Dialogue Systems and User Simulators,1C: Dialog and Interactive Systems #3,long.13,https://aclanthology.org/2021.acl-long.13,,,English,"Accuracy, BLEU",,0,0,0,0
BoB: BERT Over BERT for Training Persona-based Dialogue Models from Limited Personalized Data,1C: Dialog and Interactive Systems #4,long.14,https://aclanthology.org/2021.acl-long.14,,,English,Perplexity,,0,0,0,0
GL-GIN: Fast and Accurate Non-Autoregressive Model for Joint Multiple Intent Detection and Slot Filling,1C: Dialog and Interactive Systems #5,long.15,https://aclanthology.org/2021.acl-long.15,,,English,"Accuracy, F1",,0,0,1,0
Coreference Resolution without Span Representations,1C: Dialog and Interactive Systems #6,short.3,https://aclanthology.org/2021.acl-short.3,,,English,"MUC, B^3, CEAF",,0,1,1,0
Accelerating BERT Inference for Sequence Labeling via Early-Exit,1D: Information Extraction #1,long.16,https://aclanthology.org/2021.acl-long.16,,,"English, Chinese",F1,,0,0,1,0
Modularized Interaction Network for Named Entity Recognition,1D: Information Extraction #2,long.17,https://aclanthology.org/2021.acl-long.17,,,English,F1,,0,0,0,0
Capturing Event Argument Interaction via A Bi-Directional Entity-Level Recurrent Decoder,1D: Information Extraction #3,long.18,https://aclanthology.org/2021.acl-long.18,,,English,F1,,0,0,0,0
UniRE: A Unified Label Space for Entity Relation Extraction,1D: Information Extraction #4,long.19,https://aclanthology.org/2021.acl-long.19,,,English,F1,,0,0,1,0
Refining Sample Embeddings with Relation Prototypes to Enhance Continual Relation Extraction,1D: Information Extraction #5,long.20,https://aclanthology.org/2021.acl-long.20,,,English,Accuracy,,0,0,1,0
Enhancing Entity Boundary Detection for Better Chinese Named Entity Recognition,1D: Information Extraction #6,short.4,https://aclanthology.org/2021.acl-short.4,,,Chinese,F1,,0,0,0,0
Contrastive Learning for Many-to-many Multilingual Neural Machine Translation,1E: Machine Translation and Multilinguality #1,long.21,https://aclanthology.org/2021.acl-long.21,,,Multiple (6),BLEU,Accuracy,1,0,0,0
Understanding the Properties of Minimum Bayes Risk Decoding in Neural Machine Translation,1E: Machine Translation and Multilinguality #2,long.22,https://aclanthology.org/2021.acl-long.22,,,Multiple (8),BLEU,chrf-0.5,1,0,0,0
Multi-Head Highly Parallelized LSTM Decoder for Neural Machine Translation,1E: Machine Translation and Multilinguality #3,long.23,https://aclanthology.org/2021.acl-long.23,,,"English, German, French",BLEU,,0,0,1,0
A Bidirectional Transformer Based Alignment Model for Unsupervised Word Alignment,1E: Machine Translation and Multilinguality #4,long.24,https://aclanthology.org/2021.acl-long.24,,,"English, German, French, Romanian",Error rate,,1,0,0,0
Learning Language Specific Sub-network for Multilingual Machine Translation,1E: Machine Translation and Multilinguality #5,long.25,https://aclanthology.org/2021.acl-long.25,,,Multiple (>8),BLEU,,1,0,0,0
Difficulty-Aware Machine Translation Evaluation,1E: Machine Translation and Multilinguality #6,short.5,https://aclanthology.org/2021.acl-short.5,,,"German, English",BLEU,"TER, METEOR",0,0,0,0
Exploring the Efficacy of Automatically Generated Counterfactuals for Sentiment Analysis,"2A: Sentiment Analysis, Stylistic Analysis, and Argument Mining #1",long.26,https://aclanthology.org/2021.acl-long.26,,,English,Accuracy,,0,0,0,0
Bridge-Based Active Domain Adaptation for Aspect Term Extraction,"2A: Sentiment Analysis, Stylistic Analysis, and Argument Mining #2",long.27,https://aclanthology.org/2021.acl-long.27,,,English,Accuracy,,0,0,1,0
Multimodal Sentiment Detection Based on Multi-channel Graph Neural Networks,"2A: Sentiment Analysis, Stylistic Analysis, and Argument Mining #3",long.28,https://aclanthology.org/2021.acl-long.28,,,English,"Accuracy, F1",,0,0,0,0
Aspect-Category-Opinion-Sentiment Quadruple Extraction with Implicit Aspects and Opinions,"2A: Sentiment Analysis, Stylistic Analysis, and Argument Mining #4",long.29,https://aclanthology.org/2021.acl-long.29,,,English,"Accuracy, F1",,0,0,0,0
Uncertainty and Surprisal Jointly Deliver the Punchline: Exploiting Incongruity-Based Features for Humor Recognition,"2A: Sentiment Analysis, Stylistic Analysis, and Argument Mining #5",short.6,https://aclanthology.org/2021.acl-short.6,,,English,"Accuracy, F1",,0,0,0,0
Counterfactuals to Control Latent Disentangled Text Representations for Style Transfer,"2A: Sentiment Analysis, Stylistic Analysis, and Argument Mining #6",short.7,https://aclanthology.org/2021.acl-short.7,,,English,"Accuracy, BLEU",,0,0,0,0
PASS: Perturb-and-Select Summarizer for Product Reviews,2B: Summarization #1,long.30,https://aclanthology.org/2021.acl-long.30,,,English,ROUGE,,0,0,0,0
Deep Differential Amplifier for Extractive Summarization,2B: Summarization #2,long.31,https://aclanthology.org/2021.acl-long.31,,,English,ROUGE,,0,0,0,0
Multi-TimeLine Summarization (MTLS): Improving Timeline Summarization by Generating Multiple Summaries,2B: Summarization #3,long.32,https://aclanthology.org/2021.acl-long.32,,,English,ROUGE,,0,0,0,0
Self-Supervised Multimodal Opinion Summarization,2B: Summarization #4,long.33,https://aclanthology.org/2021.acl-long.33,,,English,ROUGE,,0,0,0,0
A Training-free and Reference-free Summarization Evaluation Metric via Centrality-weighted Relevance and Self-referenced Redundancy,2B: Summarization #5,long.34,https://aclanthology.org/2021.acl-long.34,,,English,"Pearson's r, Spearman's p",,0,0,0,0
DESCGEN: A Distantly Supervised Datasetfor Generating Entity Descriptions,2B: Summarization #6,long.35,https://aclanthology.org/2021.acl-long.35,,,English,ROUGE,,0,0,0,0
Introducing Orthogonal Constraint in Structural Probes,2C: Interpretability and Analysis of Models for NLP #1,long.36,https://aclanthology.org/2021.acl-long.36,,,English,Spearman correlation,,0,0,0,1
Hidden Killer: Invisible Textual Backdoor Attacks with Syntactic Trigger,2C: Interpretability and Analysis of Models for NLP #2,long.37,https://aclanthology.org/2021.acl-long.37,,,English,Accuracy,,0,0,0,0
Examining the Inductive Bias of Neural Language Models with Artificial Languages,2C: Interpretability and Analysis of Models for NLP #3,long.38,https://aclanthology.org/2021.acl-long.38,,,"Japanese, English, Spanish",Perplexity,,1,0,0,0
Explaining Contextualization in Language Models using Visual Analytics,2C: Interpretability and Analysis of Models for NLP #4,long.39,https://aclanthology.org/2021.acl-long.39,,,English,-,,0,0,0,1
Improving the Faithfulness of Attention-based Explanations with Task-specific Information for Text Classification,2C: Interpretability and Analysis of Models for NLP #5,long.40,https://aclanthology.org/2021.acl-long.40,,,English,F1,,0,0,0,1
Attention Flows are Shapley Value Explanations,2C: Interpretability and Analysis of Models for NLP #6,short.8,https://aclanthology.org/2021.acl-short.8,,,-,-,,0,0,0,1
Generating Landmark Navigation Instructions from Maps as a Graph-to-Text Problem,"2D: Language Grounding to Vision, Robotics and Beyond #1",long.41,https://aclanthology.org/2021.acl-long.41,,,English,BLEU,,0,0,0,0
E2E-VLP: End-to-End Vision-Language Pre-training Enhanced by Visual Learning,"2D: Language Grounding to Vision, Robotics and Beyond #2",long.42,https://aclanthology.org/2021.acl-long.42,,,English,"Accuracy, BLEU",,0,0,1,0
Learning Relation Alignment for Calibrated Cross-modal Retrieval,"2D: Language Grounding to Vision, Robotics and Beyond #3",long.43,https://aclanthology.org/2021.acl-long.43,,,English,R@K,,0,0,0,0
KM-BART: Knowledge Enhanced Multimodal BART for Visual Commonsense Generation,"2D: Language Grounding to Vision, Robotics and Beyond #4",long.44,https://aclanthology.org/2021.acl-long.44,,,English,"BLEU, METEOR, CIDER",,0,0,0,0
Video Paragraph Captioning as a Text Summarization Task,"2D: Language Grounding to Vision, Robotics and Beyond #5",short.9,https://aclanthology.org/2021.acl-short.9,,,English,"BLEU, METEOR, CIDER",,0,0,0,0
Are VQA Systems RAD? Measuring Robustness to Augmented Data with Focused Interventions,"2D: Language Grounding to Vision, Robotics and Beyond #6",short.10,https://aclanthology.org/2021.acl-short.10,,,English,Accuracy,,0,0,0,0
Cascaded Head-colliding Attention,2E: Machine Learning for NLP #1,long.45,https://aclanthology.org/2021.acl-long.45,,,"English, German",Perplexity,BLEU,0,0,0,0
Structural Knowledge Distillation: Tractably Distilling Information for Structured Predictor,2E: Machine Learning for NLP #2,long.46,https://aclanthology.org/2021.acl-long.46,,,"German, English, Spanish, Dutch",F1,,1,0,0,0
Parameter-efficient Multi-task Fine-tuning for Transformers via Shared Hypernetworks,2E: Machine Learning for NLP #3,long.47,https://aclanthology.org/2021.acl-long.47,,,English,Multiple,,0,0,1,0
COSY: COunterfactual SYntax for Cross-Lingual Understanding,2E: Machine Learning for NLP #4,long.48,https://aclanthology.org/2021.acl-long.48,,,Multiple (13),Multiple,,1,0,0,0
OoMMix: Out-of-manifold Regularization in Contextual Embedding Space for Text Classification,2E: Machine Learning for NLP #5,long.49,https://aclanthology.org/2021.acl-long.49,,,English,Accuracy,,0,0,0,0
How Helpful is Inverse Reinforcement Learning for Table-to-Text Generation?,2E: Machine Learning for NLP #6,short.11,https://aclanthology.org/2021.acl-short.11,,,English,F1,Perplexity,0,0,0,0
Understanding and Countering Stereotypes: A Computational Approach to the Stereotype Content Model,3A: Computational Social Science and Cultural Analytics #2,long.50,https://aclanthology.org/2021.acl-long.50,,,English,Accuracy,,0,1,0,0
Structurizing Misinformation Stories via Rationalizing Fact-Checks,3A: Computational Social Science and Cultural Analytics #3,long.51,https://aclanthology.org/2021.acl-long.51,,,English,Precision,,0,0,0,1
Modeling Language Usage and Listener Engagement in Podcasts,3A: Computational Social Science and Cultural Analytics #4,long.52,https://aclanthology.org/2021.acl-long.52,,,English,Accuracy,,0,0,0,0
Breaking Down the Invisible Wall of Informal Fallacies in Online Discussions,3A: Computational Social Science and Cultural Analytics #5,long.53,https://aclanthology.org/2021.acl-long.53,,,English,F1,,0,0,0,0
SocAoG: Incremental Graph Parsing for Social Relation Inference in Dialogues,3A: Computational Social Science and Cultural Analytics #6,long.54,https://aclanthology.org/2021.acl-long.54,,,English,F1,,0,0,0,0
Automatic Fake News Detection: Are Models Learning to Reason?,3A: Computational Social Science and Cultural Analytics #7,short.12,https://aclanthology.org/2021.acl-short.12,,,English,F1,,0,0,0,0
"TicketTalk: Toward human-level performance with end-to-end, transaction-based dialog systems",3B: Dialog and Interactive Systems #2,long.55,https://aclanthology.org/2021.acl-long.55,,,English,Accuracy,,0,0,0,0
Improving Dialog Systems for Negotiation with Personality Modeling,3B: Dialog and Interactive Systems #3,long.56,https://aclanthology.org/2021.acl-long.56,,,English,Agreement rate,Agent utility,0,1,0,0
Learning from Perturbations: Diverse and Informative Dialogue Generation with Inverse Adversarial Training,3B: Dialog and Interactive Systems #4,long.57,https://aclanthology.org/2021.acl-long.57,,,English,Perplexity,,0,0,0,0
Increasing Faithfulness in Knowledge-Grounded Dialogue with Controllable Features,3B: Dialog and Interactive Systems #5,long.58,https://aclanthology.org/2021.acl-long.58,,,English,BLEU,,0,0,0,1
Saying No is An Art: Contextualized Fallback Responses for Unanswerable Dialogue Queries,3B: Dialog and Interactive Systems #6,short.13,https://aclanthology.org/2021.acl-short.13,,,English,"Relevance, grammaticality",,0,0,0,0
N-Best ASR Transformer: Enhancing SLU Performance using Multiple ASR Hypotheses,3B: Dialog and Interactive Systems #7,short.14,https://aclanthology.org/2021.acl-short.14,,,English,"Accuracy, F1",,0,0,0,0
CitationIE: Leveraging the Citation Graph for Scientific Information Extraction,3C: Information Extraction #2,long.59,https://aclanthology.org/2021.acl-long.59,,,English,F1,,0,0,0,0
From Discourse to Narrative: Knowledge Projection for Event Relation Extraction,3C: Information Extraction #3,long.60,https://aclanthology.org/2021.acl-long.60,,,English,"Accuracy, F1",,0,0,0,0
AdvPicker: Effectively Leveraging Unlabeled Data via Adversarial Discriminator for Cross-Lingual NER,3C: Information Extraction #4,long.61,https://aclanthology.org/2021.acl-long.61,,,"English, Spanish, Dutch, German",F1,,1,0,0,0
Compare to The Knowledge: Graph Neural Fake News Detection with External Knowledge,3C: Information Extraction #5,long.62,https://aclanthology.org/2021.acl-long.62,,,English,F1,,0,0,0,0
Discontinuous Named Entity Recognition as Maximal Clique Discovery,3C: Information Extraction #6,long.63,https://aclanthology.org/2021.acl-long.63,,,English,F1,,0,0,0,0
LNN-EL: A Neuro-Symbolic Approach to Short-text Entity Linking,3C: Information Extraction #7,long.64,https://aclanthology.org/2021.acl-long.64,,,English,F1,,0,0,1,1
Do Context-Aware Translation Models Pay the Right Attention?,3D: Machine Translation and Multilinguality #2,long.65,https://aclanthology.org/2021.acl-long.65,,,"English, French",BLEU,"F1, COMET",0,0,0,1
Adapting High-resource NMT Models to Translate Low-resource Related Languages without Parallel Data,3D: Machine Translation and Multilinguality #3,long.66,https://aclanthology.org/2021.acl-long.66,,,Multiple (10),BLEU,,1,0,0,0
Bilingual Lexicon Induction via Unsupervised Bitext Construction and Word Alignment,3D: Machine Translation and Multilinguality #4,long.67,https://aclanthology.org/2021.acl-long.67,,,Multiple (>5),F1,,1,0,0,0
Multilingual Speech Translation from Efficient Finetuning of Pretrained Models,3D: Machine Translation and Multilinguality #5,long.68,https://aclanthology.org/2021.acl-long.68,,,Multiple (>5),BLEU,,1,0,1,0
Gender bias amplification during Speed-Quality optimization in Neural Machine Translation,3D: Machine Translation and Multilinguality #6,short.15,https://aclanthology.org/2021.acl-short.15,,,"English, Spanish, German",,,1,1,1,0
Machine Translation into Low-resource Language Varieties,3D: Machine Translation and Multilinguality #7,short.16,https://aclanthology.org/2021.acl-short.16,,,Multiple (>5),BLEU,,1,1,0,0
Learning Faithful Representations of Causal Graphs,3E: Interpretability and Analysis of Models for NLP #2,long.69,https://aclanthology.org/2021.acl-long.69,,,English,AUC,,0,0,0,1
What Context Features Can Transformer Language Models Use?,3E: Interpretability and Analysis of Models for NLP #3,long.70,https://aclanthology.org/2021.acl-long.70,,,English,Likelihood,,0,0,0,1
Integrated Directional Gradients: Feature Interaction Attribution for Neural NLP Models,3E: Interpretability and Analysis of Models for NLP #4,long.71,https://aclanthology.org/2021.acl-long.71,,,English,Accuracy,,0,0,0,1
Is Sparse Attention more Interpretable?,3E: Interpretability and Analysis of Models for NLP #5,short.17,https://aclanthology.org/2021.acl-short.17,,,English,Entropy,,0,0,0,1
The Case for Translation-Invariant Self-Attention in Transformer-Based Language Models,3E: Interpretability and Analysis of Models for NLP #6,short.18,https://aclanthology.org/2021.acl-short.18,,,English,Multiple,,0,0,0,0
Relative Importance in Sentence Processing,3E: Interpretability and Analysis of Models for NLP #7,short.19,https://aclanthology.org/2021.acl-short.19,,,English,Spearman correlation,,0,0,0,1
Changes in European Solidarity Before and During COVID-19: Evidence from a Large Crowd- and Expert-Annotated Twitter Dataset,4A: Computational Social Science and Cultural Analytics #3,long.129,https://aclanthology.org/2021.acl-long.129,,,"English, German",F1,,0,0,0,0
Measuring Conversational Uptake: A Case Study on Student-Teacher Interactions,4A: Computational Social Science and Cultural Analytics #4,long.130,https://aclanthology.org/2021.acl-long.130,,,English,Spearman correlation,,0,0,0,0
A Survey of Code-switching: Linguistic and Social Perspectives for Language Technologies,4A: Computational Social Science and Cultural Analytics #5,long.131,https://aclanthology.org/2021.acl-long.131,,,"English, German, French, Hindi, Spanish",-,,0,0,0,0
Learning from the Worst: Dynamically Generated Datasets to Improve Online Hate Detection,4A: Computational Social Science and Cultural Analytics #6,long.132,https://aclanthology.org/2021.acl-long.132,,,English,Error rate,,0,1,0,0
InfoSurgeon: Cross-Media Fine-grained Information Consistency Checking for Fake News Detection,4A: Computational Social Science and Cultural Analytics #7,long.133,https://aclanthology.org/2021.acl-long.133,,,English,Accuracy,,0,0,0,0
On Positivity Bias in Negative Reviews,4A: Computational Social Science and Cultural Analytics #8,short.39,https://aclanthology.org/2021.acl-short.39,,,English,Accuracy,,0,1,0,0
"I like fish, especially dolphins: Addressing Contradictions in Dialogue Modeling",4B: Dialog and Interactive Systems #3,long.134,https://aclanthology.org/2021.acl-long.134,,,English,Accuracy,,0,0,0,0
A Sequence-to-Sequence Approach to Dialogue State Tracking,4B: Dialog and Interactive Systems #4,long.135,https://aclanthology.org/2021.acl-long.135,,,English,Accuracy,,0,0,0,0
Discovering Dialog Structure Graph for Coherent Dialog Generation,4B: Dialog and Interactive Systems #5,long.136,https://aclanthology.org/2021.acl-long.136,,,Chinese,"NLL, BLEU",,0,0,0,0
Dialogue Response Selection with Hierarchical Curriculum Learning,4B: Dialog and Interactive Systems #6,long.137,https://aclanthology.org/2021.acl-long.137,,,Chinese,"MAP, MRR",,0,0,0,0
A Joint Model for Dropped Pronoun Recovery and Conversational Discourse Parsing in Chinese Conversational Speech,4B: Dialog and Interactive Systems #7,long.138,https://aclanthology.org/2021.acl-long.138,,,Chinese,F1,,0,0,0,0
PRAL: A Tailored Pre-Training Model for Task-Oriented Dialog Generation,4B: Dialog and Interactive Systems #8,short.40,https://aclanthology.org/2021.acl-short.40,,,English,BLEU,Perplexity,0,0,0,0
A Systematic Investigation of KB-Text Embedding Alignment at Scale,4C: Information Extraction #3,long.139,https://aclanthology.org/2021.acl-long.139,,,English,MR,,0,0,0,0
Named Entity Recognition with Small Strongly Labeled and Large Weakly Labeled Data,4C: Information Extraction #4,long.140,https://aclanthology.org/2021.acl-long.140,,,"English, French, Italian, German, Spanish",F1,,1,0,0,0
Ultra-Fine Entity Typing with Weak Supervision from a Masked Language Model,4C: Information Extraction #5,long.141,https://aclanthology.org/2021.acl-long.141,,,English,F1,,0,0,0,0
Improving Named Entity Recognition by External Context Retrieving and Cooperative Learning,4C: Information Extraction #6,long.142,https://aclanthology.org/2021.acl-long.142,,,English,F1,,0,0,0,0
ROPE: Reading Order Equivariant Positional Encoding for Graph-based Document Information Extraction,4C: Information Extraction #7,short.41,https://aclanthology.org/2021.acl-short.41,,,English,F1,,0,0,0,0
Zero-shot Event Extraction via Transfer Learning: Challenges and Insights,4C: Information Extraction #8,short.42,https://aclanthology.org/2021.acl-short.42,,,English,F1,,0,0,0,0
Implicit Representations of Meaning in Neural Language Models,4D: Interpretability and Analysis of Models for NLP #3,long.143,https://aclanthology.org/2021.acl-long.143,,,English,F1,,0,0,0,1
Causal Analysis of Syntactic Agreement Mechanisms in Neural Language Models,4D: Interpretability and Analysis of Models for NLP #4,long.144,https://aclanthology.org/2021.acl-long.144,,,English,Total effect,,0,0,0,1
Bird’s Eye: Probing for Linguistic Graph Structures with a Simple Information-Theoretic Approach,4D: Interpretability and Analysis of Models for NLP #5,long.145,https://aclanthology.org/2021.acl-long.145,,,English,AUC,,0,0,1,1
Knowledgeable or Educated Guess? Revisiting Language Models as Knowledge Bases,4D: Interpretability and Analysis of Models for NLP #6,long.146,https://aclanthology.org/2021.acl-long.146,,,English,Precision,,0,0,0,0
Poisoning Knowledge Graph Embeddings via Relation Inference Patterns,4D: Interpretability and Analysis of Models for NLP #7,long.147,https://aclanthology.org/2021.acl-long.147,,,English,"MRR, Hits@1",,0,0,0,0
Using Adversarial Attacks to Reveal the Statistical Bias in Machine Reading Comprehension Models,4D: Interpretability and Analysis of Models for NLP #8,short.43,https://aclanthology.org/2021.acl-short.43,,,English,Accuracy,,0,0,0,0
Bad Seeds: Evaluating Lexical Methods for Bias Measurement,4E: Ethics in NLP #1,long.148,https://aclanthology.org/2021.acl-long.148,,,English,"Coherence, WEAT",,0,1,0,0
"A Survey of Race, Racism, and Anti-Racism in NLP",4E: Ethics in NLP #2,long.149,https://aclanthology.org/2021.acl-long.149,,,English,-,,0,1,0,0
Intrinsic Bias Metrics Do Not Correlate with Application Bias,4E: Ethics in NLP #3,long.150,https://aclanthology.org/2021.acl-long.150,,,"English, Spanish",WEAT,,0,1,0,0
RedditBias: A Real-World Resource for Bias Evaluation and Debiasing of Conversational Language Models,4E: Ethics in NLP #4,long.151,https://aclanthology.org/2021.acl-long.151,,,English,"F1, BLEU",,0,1,0,0
Quantifying and Avoiding Unfair Qualification Labour in Crowdsourcing,4E: Ethics in NLP #5,short.44,https://aclanthology.org/2021.acl-short.44,,,English,Percentage of Hits accepted,,0,1,0,0
"Men Are Elected, Women Are Married: Events Gender Bias on Wikipedia",4E: Ethics in NLP #6,short.45,https://aclanthology.org/2021.acl-short.45,,,English,WEAT,,0,1,0,0
Contributions of Transformer Attention Heads in Multi- and Cross-lingual Tasks,5A: Machine Translation and Multilinguality #3,long.152,https://aclanthology.org/2021.acl-long.152,,,Multiple (9),F1,,1,0,0,0
Crafting Adversarial Examples for Neural Machine Translation,5A: Machine Translation and Multilinguality #4,long.153,https://aclanthology.org/2021.acl-long.153,,,Multiple (4),BLEU,,1,0,0,0
UXLA: A Robust Unsupervised Data Augmentation Framework for Cross-Lingual NLP,5A: Machine Translation and Multilinguality #5,long.154,https://aclanthology.org/2021.acl-long.154,,,Multiple (6),"Accuracy, F1",,1,0,1,0
Glancing Transformer for Non-Autoregressive Neural Machine Translation,5A: Machine Translation and Multilinguality #6,long.155,https://aclanthology.org/2021.acl-long.155,,,"English, German, Romanian",BLEU,,0,0,1,0
Modeling Task-Aware MIMO Cardinality for Efficient Multilingual Neural Machine Translation,5A: Machine Translation and Multilinguality #7,short.46,https://aclanthology.org/2021.acl-short.46,,,Multiple (>10),BLEU,Win ratio,1,0,0,0
Adaptive Nearest Neighbor Machine Translation,5A: Machine Translation and Multilinguality #8,short.47,https://aclanthology.org/2021.acl-short.47,,,"English, German",BLEU,,0,0,0,0
