Name,Session,ID,URL,Dataset,Domain,Language(s),Main metric,Other metrics,Multilingual?,Fairness or bias?,Efficiency?,Interpretability?
Every Bite Is an Experience: Key Point Analysis of Business Reviews,"9E: Sentiment Analysis, Stylistic Analysis, and Argument Mining #4",long.262,https://aclanthology.org/2021.acl-long.262,,,English,"Precision, Recall",,0,0,0,0
Structured Sentiment Analysis as Dependency Graph Parsing,"9E: Sentiment Analysis, Stylistic Analysis, and Argument Mining #5",long.263,https://aclanthology.org/2021.acl-long.263,,,English,F1,,0,0,0,0
Thank you BART! Rewarding Pre-Trained Models Improves Formality Style Transfer,"9E: Sentiment Analysis, Stylistic Analysis, and Argument Mining #6",short.62,https://aclanthology.org/2021.acl-short.62,,,English,"BLEU, Accuracy",BLEURT,0,0,0,0
Deep Context- and Relation-Aware Learning for Aspect-based Sentiment Analysis,"9E: Sentiment Analysis, Stylistic Analysis, and Argument Mining #7",short.63,https://aclanthology.org/2021.acl-short.63,,,English,"Accuracy, F1",,0,0,0,0
Towards Generative Aspect-Based Sentiment Analysis,"9E: Sentiment Analysis, Stylistic Analysis, and Argument Mining #8",short.64,https://aclanthology.org/2021.acl-short.64,,,English,"Accuracy, F1",,0,0,0,0
Consistency Regularization for Cross-Lingual Fine-Tuning,10A: Machine Translation and Multilinguality #6,long.264,https://aclanthology.org/2021.acl-long.264,,,Multiple (XTREME),Multiple,,1,0,0,0
Improving Pretrained Cross-Lingual Language Models via Self-Labeled Word Alignment,10A: Machine Translation and Multilinguality #7,long.265,https://aclanthology.org/2021.acl-long.265,,,Multiple (XTREME),Multiple,,1,0,0,0
Rejuvenating Low-Frequency Words: Making the Most of Parallel Data in Non-Autoregressive Translation,10A: Machine Translation and Multilinguality #8,long.266,https://aclanthology.org/2021.acl-long.266,,,Multiple (5),BLEU,ALF,1,0,0,0
G-Transformer for Document-Level Machine Translation,10A: Machine Translation and Multilinguality #9,long.267,https://aclanthology.org/2021.acl-long.267,,,"English, German",BLEU,,0,0,0,0
Prevent the Language Model from being Overconfident in Neural Machine Translation,10A: Machine Translation and Multilinguality #10,long.268,https://aclanthology.org/2021.acl-long.268,,,Multiple (4),BLEU,,1,0,0,0
Bilingual Mutual Information Based Adaptive Training for Neural Machine Translation,10A: Machine Translation and Multilinguality #11,short.65,https://aclanthology.org/2021.acl-short.65,,,"German, Chinese",BLEU,,0,0,0,0
Towards Emotional Support Dialog Systems,10B: Dialog and Interactive Systems #5,long.269,https://aclanthology.org/2021.acl-long.269,,,English,Multiple,,0,1,0,0
Novel Slot Detection: A Benchmark for Discovering Unknown Slot Types in the Task-Oriented Dialogue System,10B: Dialog and Interactive Systems #6,long.270,https://aclanthology.org/2021.acl-long.270,,,English,F1,New: ROSE,0,0,0,0
GTM: A Generative Triple-wise Model for Conversational Question Generation,10B: Dialog and Interactive Systems #7,long.271,https://aclanthology.org/2021.acl-long.271,,,English,Multiple,,0,0,1,0
Diversifying Dialog Generation via Adaptive Label Smoothing,10B: Dialog and Interactive Systems #8,long.272,https://aclanthology.org/2021.acl-long.272,,,English,Multiple,,0,0,0,0
Out-of-Scope Intent Detection with Self-Supervision and Discriminative Training,10B: Dialog and Interactive Systems #9,long.273,https://aclanthology.org/2021.acl-long.273,,,English,"Accuracy, F1",,0,0,1,0
"Continual Learning for Task-oriented Dialogue System with Iterative Network Pruning, Expanding and Masking",10B: Dialog and Interactive Systems #10,short.66,https://aclanthology.org/2021.acl-short.66,,,English,BLEU,F1,0,0,0,0
Document-level Event Extraction via Heterogeneous Graph-based Interaction Model with a Tracker,10C: Information Extraction #5,long.274,https://aclanthology.org/2021.acl-long.274,,,English,F1,,0,0,0,0
Nested Named Entity Recognition via Explicitly Excluding the Influence of the Best Path,10C: Information Extraction #6,long.275,https://aclanthology.org/2021.acl-long.275,,,English,F1,,0,0,1,0
LearnDA: Learnable Knowledge-Guided Data Augmentation for Event Causality Identification,10C: Information Extraction #7,long.276,https://aclanthology.org/2021.acl-long.276,,,English,F1,,0,0,1,0
Revisiting the Negative Data of Distantly Supervised Relation Extraction,10C: Information Extraction #8,long.277,https://aclanthology.org/2021.acl-long.277,,,"English, Chinese",F1,,0,0,0,0
Knowing the No-match: Entity Alignment with Dangling Cases,10C: Information Extraction #9,long.278,https://aclanthology.org/2021.acl-long.278,,,Multiple (4),Hits@k,"MRR, F1",1,0,1,0
TIMERS: Document-level Temporal Relation Extraction,10C: Information Extraction #10,short.67,https://aclanthology.org/2021.acl-short.67,,,English,F1,,0,0,0,0
Superbizarre Is Not Superb: Derivational Morphology Improves BERT's Interpretation of Complex Words,"10D: Phonology, Morphology and Word Segmentation #1",long.279,https://aclanthology.org/2021.acl-long.279,,,English,Accuracy,,0,0,0,0
Optimizing over Subsequences Generates Context-Sensitive Languages,"10D: Phonology, Morphology and Word Segmentation #2",TACL,https://transacl.org/ojs/index.php/tacl/article/view/2689,,,English,None,,0,0,0,0
Morphology Matters: A Multilingual Language Modeling Analysis,"10D: Phonology, Morphology and Word Segmentation #3",TACL,https://arxiv.org/abs/2012.06262,,,Multiple (92),Spearman's rho,Multiple,1,0,0,1
Improving Arabic Diacritization with Regularized Decoding and Adversarial Training,"10D: Phonology, Morphology and Word Segmentation #4",short.68,https://aclanthology.org/2021.acl-short.68,,,Arabic,WER,"Accuracy, DER",0,0,0,0
When is Char Better Than Subword: A Systematic Study of Segmentation Algorithms for Neural Machine Translation,"10D: Phonology, Morphology and Word Segmentation #5",short.69,https://aclanthology.org/2021.acl-short.69,,,Multiple (9),BLEU,chrF3,1,0,0,0
More than Text: Multi-modal Chinese Word Segmentation,"10D: Phonology, Morphology and Word Segmentation #6",short.70,https://aclanthology.org/2021.acl-short.70,,,Chinese,F1,,0,0,0,0
BERT is to NLP what AlexNet is to CV: Can Pre-Trained Language Models Identify Analogies?,10E: Semantics: Lexical Semantics #1,long.280,https://aclanthology.org/2021.acl-long.280,,,English,Accuracy,,0,0,0,0
Exploring the Representation of Word Meanings in Context: A Case Study on Homonymy and Synonymy,10E: Semantics: Lexical Semantics #2,long.281,https://aclanthology.org/2021.acl-long.281,,,"English, Galician, Spanish, Portuguese",F1,,1,0,0,0
Measuring Fine-Grained Domain Relevance of Terms: A Hierarchical Core-Fringe Approach,10E: Semantics: Lexical Semantics #3,long.282,https://aclanthology.org/2021.acl-long.282,,,English,ROC-AUC,"PR-AUC, Accuracy",0,0,0,0
A Mixture-of-Experts Model for Antonym-Synonym Discrimination,10E: Semantics: Lexical Semantics #4,short.71,https://aclanthology.org/2021.acl-short.71,,,English,F1,,0,0,0,0
Learning Domain-Specialised Representations for Cross-Lingual Biomedical Entity Linking,10E: Semantics: Lexical Semantics #5,short.72,https://aclanthology.org/2021.acl-short.72,,,Multiple (10),Hits@k,,1,0,1,0
A Cluster-based Approach for Improving Isotropy in Contextual Embedding Space,10E: Semantics: Lexical Semantics #6,short.73,https://aclanthology.org/2021.acl-short.73,,,English,Accuracy,"Matthew correlation, Spearman's rho",0,0,1,0
HERALD: An Annotation Efficient Method to Detect User Disengagement in Social Conversations,11A: Dialog and Interactive Systems #6,long.283,https://aclanthology.org/2021.acl-long.283,,,English,"Accuracy, F1",,0,0,1,0
Value-Agnostic Conversational Semantic Parsing,11A: Dialog and Interactive Systems #7,long.284,https://aclanthology.org/2021.acl-long.284,,,English,Accuracy,,0,0,0,0
MPC-BERT: A Pre-Trained Language Model for Multi-Party Conversation Understanding,11A: Dialog and Interactive Systems #8,long.285,https://aclanthology.org/2021.acl-long.285,,,English,Hits@k,Accuracy,0,0,0,0
Best of Both Worlds: Making High Accuracy Non-incremental Transformer-based Disfluency Detection Incremental,11A: Dialog and Interactive Systems #9,long.286,https://aclanthology.org/2021.acl-long.286,,,English,"Accuracy, F1",,0,0,0,0
NeuralWOZ: Learning to Collect Task-Oriented Dialogue via Model-Based Simulation,11A: Dialog and Interactive Systems #10,long.287,https://aclanthology.org/2021.acl-long.287,,,English,Accuracy,,0,0,1,0
Unsupervised Enrichment of Persona-grounded Dialog with Background Stories,11A: Dialog and Interactive Systems #11,short.74,https://aclanthology.org/2021.acl-short.74,,,English,Multiple,,0,0,0,0
CDRNN: Discovering Complex Dynamics in Human Language Processing,"11B: Linguistic Theories, Cognitive Modeling and Psycholinguistics #1",long.288,https://aclanthology.org/2021.acl-long.288,,,English,IRF,,0,0,0,1
Structural Guidance for Transformer Language Models,"11B: Linguistic Theories, Cognitive Modeling and Psycholinguistics #2",long.289,https://aclanthology.org/2021.acl-long.289,,,English,Perplexity,,0,0,1,0
Surprisal Estimators for Human Reading Times Need Character Models,"11B: Linguistic Theories, Cognitive Modeling and Psycholinguistics #3",long.290,https://aclanthology.org/2021.acl-long.290,,,English,Perplexity,Surprisal estimate,0,0,0,0
CogAlign: Learning to Align Textual Neural Representations to Cognitive Language Processing Signals,"11B: Linguistic Theories, Cognitive Modeling and Psycholinguistics #4",long.291,https://aclanthology.org/2021.acl-long.291,,,English,F1,,0,0,0,1
Formal Basis of a Language Universal,"11B: Linguistic Theories, Cognitive Modeling and Psycholinguistics #5",TACL,https://direct.mit.edu/coli/article/47/1/9/97333/Formal-Basis-of-a-Language-Universal,,,English,None,,0,0,0,0
Beyond Laurel/Yanny: An Autoencoder-Enabled Search for Polyperceivable Audio,"11B: Linguistic Theories, Cognitive Modeling and Psycholinguistics #6",short.75,https://aclanthology.org/2021.acl-short.75,,,English,Custom-made,,0,0,0,0
Self-Attention Networks Can Process Bounded Hierarchical Languages,11C: Machine Learning for NLP #5,long.292,https://aclanthology.org/2021.acl-long.292,,,Formal languages: Dyck,Accuracy,,0,0,0,1
TextSETTR: Few-Shot Text Style Extraction and Tunable Targeted Restyling,11C: Machine Learning for NLP #6,long.293,https://aclanthology.org/2021.acl-long.293,,,English,Accuracy,"Content, G, Human-based",0,0,1,0
H-Transformer-1D: Fast One-Dimensional Hierarchical Attention for Sequences,11C: Machine Learning for NLP #7,long.294,https://aclanthology.org/2021.acl-long.294,,,English,Accuracy,Perplexity,0,0,0,0
Making Pre-trained Language Models Better Few-shot Learners,11C: Machine Learning for NLP #8,long.295,https://aclanthology.org/2021.acl-long.295,,,English,Accuracy,"F1, Spearman, Matthew",0,0,1,0
A Sweet Rabbit Hole by DARCY: Using Honeypots to Detect Universal Trigger's Adversarial Attacks,11C: Machine Learning for NLP #9,long.296,https://aclanthology.org/2021.acl-long.296,,,English,F1,Multiple,0,0,0,0
Don't Let Discourse Confine Your Model: Sequence Perturbations for Improved Event Language Models,11C: Machine Learning for NLP #10,short.76,https://aclanthology.org/2021.acl-short.76,,,English,Perplexity,Accuracy,0,0,1,0
Towards Propagation Uncertainty: Edge-enhanced Bayesian Graph Convolutional Networks for Rumor Detection,11D: Information Retrieval and Text Mining #1,long.297,https://aclanthology.org/2021.acl-long.297,,,English,Accuracy,F1,0,0,0,0
Label-Specific Dual Graph Neural Network for Multi-Label Text Classification,11D: Information Retrieval and Text Mining #2,long.298,https://aclanthology.org/2021.acl-long.298,,,English,Hits@k,NDCG,0,0,0,0
TAN-NTM: Topic Attention Networks for Neural Topic Modeling,11D: Information Retrieval and Text Mining #3,long.299,https://aclanthology.org/2021.acl-long.299,,,English,Accuracy,Multiple,0,0,1,0
Cross-language Sentence Selection via Data Augmentation and Rationale Training,11D: Information Retrieval and Text Mining #4,long.300,https://aclanthology.org/2021.acl-long.300,,,"English, Somali, Swahili, Tagalog",MAP,SN10,1,0,1,0
A Neural Model for Joint Document and Snippet Ranking in Question Answering for Large Document Collections,11D: Information Retrieval and Text Mining #5,long.301,https://aclanthology.org/2021.acl-long.301,,,English,MAP,Recall,0,0,1,0
The Curse of Dense Low-Dimensional Information Retrieval for Large Index Sizes,11D: Information Retrieval and Text Mining #6,short.77,https://aclanthology.org/2021.acl-short.77,,,English,MRR,Relative error rate,0,0,1,0
W-RST: Towards a Weighted RST-style Discourse Framework,11E: Discourse and Pragmatics #1,long.302,https://aclanthology.org/2021.acl-long.302,,,English,Accuracy,ROUGE,0,0,0,0
ABCD: A Graph Framework to Convert Complex Sentences to a Covering Set of Simple Sentences,11E: Discourse and Pragmatics #2,long.303,https://aclanthology.org/2021.acl-long.303,,,English,Accuracy,"Exact match, BLEU, BERTScore",0,0,0,0
Which Linguist Invented the Lightbulb? Presupposition Verification for Question-Answering,11E: Discourse and Pragmatics #3,long.304,https://aclanthology.org/2021.acl-long.304,,,English,"Accuracy, F1",,0,0,0,1
Adversarial Learning for Discourse Rhetorical Structure Parsing,11E: Discourse and Pragmatics #4,long.305,https://aclanthology.org/2021.acl-long.305,,,"English, Chinese",F1,,0,0,1,0
Exploring Discourse Structures for Argument Impact Classification,11E: Discourse and Pragmatics #5,long.306,https://aclanthology.org/2021.acl-long.306,,,English,F1,,0,0,0,1
"Point, Disambiguate and Copy: Incorporating Bilingual Dictionaries for Neural Machine Translation",12A: Machine Translation and Multilinguality #7,long.307,https://aclanthology.org/2021.acl-long.307,,,"English, Chinese, Japanese",BLEU,,0,0,0,0
VECO: Variable and Flexible Cross-lingual Pre-training for Language Understanding and Generation,12A: Machine Translation and Multilinguality #8,long.308,https://aclanthology.org/2021.acl-long.308,,,Multiple (XTREME),Accuracy,"F1, Exact Match",1,0,1,0
A unified approach to sentence segmentation of punctuated text in many languages,12A: Machine Translation and Multilinguality #9,long.309,https://aclanthology.org/2021.acl-long.309,,,Multiple (87),F1,,1,0,1,0
Towards User-Driven Neural Machine Translation,12A: Machine Translation and Multilinguality #10,long.310,https://aclanthology.org/2021.acl-long.310,,,"English, Chinese",BLEU,METEOR,0,0,0,0
End-to-End Lexically Constrained Machine Translation for Morphologically Rich Languages,12A: Machine Translation and Multilinguality #11,long.311,https://aclanthology.org/2021.acl-long.311,,,"English, Czech",BLEU,Cvg,0,0,0,0
Cross-lingual Text Classification with Heterogeneous Graph Neural Network,12A: Machine Translation and Multilinguality #12,short.78,https://aclanthology.org/2021.acl-short.78,,,Multiple (7),Accuracy,,1,0,0,0
Handling Extreme Class Imbalance in Technical Logbook Datasets,12B: Resources and Evaluation #4,long.312,https://aclanthology.org/2021.acl-long.312,,,English,F1,,0,0,0,0
ILDC for CJPE: Indian Legal Documents Corpus for Court Judgment Prediction and Explanation,12B: Resources and Evaluation #5,long.313,https://aclanthology.org/2021.acl-long.313,,,English,IAA ,F1,0,0,0,1
Supporting Cognitive and Emotional Empathic Writing of Students,12B: Resources and Evaluation #6,long.314,https://aclanthology.org/2021.acl-long.314,,,German,IAA(alpha),IAA(pi),0,0,0,0
Context-aware Adversarial Training for Name Regularity Bias in Named Entity Recognition,12B: Resources and Evaluation #7,TACL,https://direct.mit.edu/tacl/article/doi/10.1162/tacl_a_00386/102846/Context-aware-Adversarial-Training-for-Name,,,English,F1,,0,1,0,0
SummEval: Re-evaluating Summarization Evaluation,12B: Resources and Evaluation #8,TACL,https://direct.mit.edu/tacl/article/doi/10.1162/tacl_a_00373/100686/SummEval-Re-evaluating-Summarization-Evaluation,,,English,Kendall's tau,,0,0,0,0
Towards Question-Answering as an Automatic Metric for Evaluating the Content Quality of a Summary,12B: Resources and Evaluation #9,TACL,https://direct.mit.edu/tacl/article/doi/10.1162/tacl_a_00397/106792/Towards-Question-Answering-as-an-Automatic-Metric,,,English,Pearson,,0,0,0,0
Dual Reader-Parser on Hybrid Textual and Tabular Evidence for Open Domain Question Answering,12C: Question Answering #3,long.315,https://aclanthology.org/2021.acl-long.315,,,English,Exact match,,0,0,0,0
Generation-Augmented Retrieval for Open-Domain Question Answering,12C: Question Answering #4,long.316,https://aclanthology.org/2021.acl-long.316,,,English,ROUGE F1,Top-k retrieval accuracy,0,0,1,0
Check It Again：Progressive Visual Question Answering via Visual Entailment,12C: Question Answering #5,long.317,https://aclanthology.org/2021.acl-long.317,,,English,Accuracy,,0,0,0,0
A Mutual Information Maximization Approach for the Spurious Solution Problem in Weakly Supervised Question Answering,12C: Question Answering #6,long.318,https://aclanthology.org/2021.acl-long.318,,,English,Exact match,Accuracy,0,0,0,0
Relevance-guided Supervision for OpenQA with ColBERT,12C: Question Answering #7,TACL,https://direct.mit.edu/tacl/article/doi/10.1162/tacl_a_00405/107205/Relevance-guided-Supervision-for-OpenQA-with,,,English,Exact match,Retrieval accuracy,0,0,0,0
Towards more equitable question answering systems: How much more data do you need?,12C: Question Answering #8,short.79,https://aclanthology.org/2021.acl-short.79,,,Multiple (7),F1,,1,0,0,0
Breaking Down Walls of Text: How Can NLP Benefit Consumer Privacy?,12D: Theme #1,long.319,https://aclanthology.org/2021.acl-long.319,,,None,None,,0,0,0,0
Supporting Land Reuse of Former Open Pit Mining Sites using Text Classification and Active Learning,12D: Theme #2,long.320,https://aclanthology.org/2021.acl-long.320,,,German,F1,,0,0,0,1
Reliability Testing for Natural Language Processing Systems,12D: Theme #3,long.321,https://aclanthology.org/2021.acl-long.321,,,None,None,,0,1,0,0
Learning Language and Multimodal Privacy-Preserving Markers of Mood from Mobile Data,12D: Theme #4,long.322,https://aclanthology.org/2021.acl-long.322,,,Multilingual,F1,,1,0,1,0
"Anonymisation Models for Text Data: State of the art, Challenges and Future Directions",12D: Theme #5,long.323,https://aclanthology.org/2021.acl-long.323,,,English,F1,IAA,0,0,0,0
On Compositional Generalization of Neural Machine Translation,13A: Machine Translation and Multilinguality #8,long.368,https://aclanthology.org/2021.acl-long.368,,,"English, Chinese",BLEU,Compound error rate,0,0,0,0
Mask-Align: Self-Supervised Neural Word Alignment,13A: Machine Translation and Multilinguality #9,long.369,https://aclanthology.org/2021.acl-long.369,,,"English, Romanian, French, Chinese, German",AER,,1,0,0,0
GWLAN: General Word-Level AutocompletioN for Computer-Aided Translation,13A: Machine Translation and Multilinguality #10,long.370,https://aclanthology.org/2021.acl-long.370,,,"English, German, Chinese",Accuracy,,0,0,0,0
Improving Lexically Constrained Neural Machine Translation with Source-Conditioned Masked Span Prediction,13A: Machine Translation and Multilinguality #11,short.94,https://aclanthology.org/2021.acl-short.94,,,"English, German, Korean",BLEU,,0,0,0,0
De-biasing Distantly Supervised Named Entity Recognition via Causal Intervention,13B: Information Extraction #6,long.371,https://aclanthology.org/2021.acl-long.371,,,English,F1,,0,0,0,0
A Span-Based Model for Joint Overlapped and Discontinuous Named Entity Recognition,13B: Information Extraction #7,long.372,https://aclanthology.org/2021.acl-long.372,,,English,F1,,0,0,0,0
MLBiNet: A Cross-Sentence Collective Event Detection Network,13B: Information Extraction #8,long.373,https://aclanthology.org/2021.acl-long.373,,,English,F1,,0,0,0,0
Exploiting Document Structures and Cluster Consistencies for Event Coreference Resolution,13B: Information Extraction #9,long.374,https://aclanthology.org/2021.acl-long.374,,,English,B3,CEAF,0,0,0,0
StereoRel: Relational Triple Extraction from a Stereoscopic Perspective,13B: Information Extraction #10,long.375,https://aclanthology.org/2021.acl-long.375,,,English,F1,,0,0,0,0
Knowledge-Enriched Event Causality Identification via Latent Structure Induction Networks,13B: Information Extraction #11,long.376,https://aclanthology.org/2021.acl-long.376,,,English,F1,,0,0,0,0
Turn the Combination Lock: Learnable Textual Backdoor Attacks via Word Substitution,13C: Machine Learning for NLP #6,long.377,https://aclanthology.org/2021.acl-long.377,,,English,"Accuracy, F1",,0,1,0,0
Parameter-Efficient Transfer Learning with Diff Pruning,13C: Machine Learning for NLP #7,long.378,https://aclanthology.org/2021.acl-long.378,,,English,Accuracy,,0,0,1,0
R2D2: Recursive Transformer based on Differentiable Tree for Interpretable Hierarchical Language Modeling,13C: Machine Learning for NLP #8,long.379,https://aclanthology.org/2021.acl-long.379,,,English,F1,Recall ,0,0,1,0
Risk Minimization for Zero-shot Sequence Labeling,13C: Machine Learning for NLP #9,long.380,https://aclanthology.org/2021.acl-long.380,,,Multilingual,"Accuracy, F1",,1,0,0,0
WARP: Word-level Adversarial ReProgramming,13C: Machine Learning for NLP #10,long.381,https://aclanthology.org/2021.acl-long.381,,,English,Accuracy,,0,0,1,0
Lexicon Learning for Few Shot Sequence Modeling,13C: Machine Learning for NLP #11,long.382,https://aclanthology.org/2021.acl-long.382,,,"English, Chinese",Accuracy,BLEU,0,0,0,0
Personalized Transformer for Explainable Recommendation,13D: NLP Applications #3,long.383,https://aclanthology.org/2021.acl-long.383,,,English,BLEU,Rouge ,0,0,0,1
Generating SOAP Notes from Doctor-Patient Conversations Using Modular Summarization Techniques,13D: NLP Applications #4,long.384,https://aclanthology.org/2021.acl-long.384,,,English,Rouge-1,Rouge-L,0,0,0,0
Tail-to-Tail Non-Autoregressive Sequence Prediction for Chinese Grammatical Error Correction,13D: NLP Applications #5,long.385,https://aclanthology.org/2021.acl-long.385,,,Chinese ,"Accuracy, F1",,0,0,1,0
Early Detection of Sexual Predators in Chats,13D: NLP Applications #6,long.386,https://aclanthology.org/2021.acl-long.386,,,English,F1,F-latency,0,0,1,0
Writing by Memorizing: Hierarchical Retrieval-based Medical Report Generation,13D: NLP Applications #7,long.387,https://aclanthology.org/2021.acl-long.387,,,English,cIDER,Rouge-L,0,0,0,0
Quotation Recommendation and Interpretation Based on Transformation from Queries to Quotations,13D: NLP Applications #8,short.95,https://aclanthology.org/2021.acl-short.95,,,"English, Chinese ",MAP,P@1,0,0,0,0
Concept-Based Label Embedding via Dynamic Routing for Hierarchical Text Classification,13E: Information Retrieval and Text Mining #2,long.388,https://aclanthology.org/2021.acl-long.388,,,English,Accuracy,,0,0,0,0
VisualSparta: An Embarrassingly Simple Approach to Large-scale Text-to-Image Search with Weighted Bag-of-words,13E: Information Retrieval and Text Mining #3,long.389,https://aclanthology.org/2021.acl-long.389,,,English,R@1,R@5,0,0,1,0
Few-Shot Text Ranking with Meta Adapted Synthetic Weak Supervision,13E: Information Retrieval and Text Mining #4,long.390,https://aclanthology.org/2021.acl-long.390,,,English,NDCG@20,P@20,0,0,0,0
Semi-Supervised Text Classification with Balanced Deep Representation Distributions,13E: Information Retrieval and Text Mining #5,long.391,https://aclanthology.org/2021.acl-long.391,,,English,Micro-F1,Macro-F1,0,0,0,0
Improving Document Representations by Generating Pseudo Query Embeddings for Dense Retrieval,13E: Information Retrieval and Text Mining #6,long.392,https://aclanthology.org/2021.acl-long.392,,,English,MRR@10,Recall@1k,0,0,0,0
Pre-training is a Hot Topic: Contextualized Document Embeddings Improve Topic Coherence,13E: Information Retrieval and Text Mining #7,short.96,https://aclanthology.org/2021.acl-short.96,,,English,PMI,Rank-biased Overlap,0,0,0,0
Keep It Simple: Unsupervised Simplification of Multi-Paragraph Text,14A: Language Generation #2,long.498,https://aclanthology.org/2021.acl-long.498,,,English,SARI,,0,0,0,0
Long Text Generation by Modeling Sentence-Level and Discourse-Level Coherence,14A: Language Generation #3,long.499,https://aclanthology.org/2021.acl-long.499,,,English,Perplexity,BLEU,0,0,0,0
OpenMEVA: A Benchmark for Evaluating Open-ended Story Generation Metrics,14A: Language Generation #4,long.500,https://aclanthology.org/2021.acl-long.500,,,English,Pearson's rho,,0,0,0,0
DYPLOC: Dynamic Planning of Content Using Mixed Language Models for Text Generation,14A: Language Generation #5,long.501,https://aclanthology.org/2021.acl-long.501,,,English,BLEU,METEOR,0,0,0,0
Controllable Open-ended Question Generation with A New Question Type Ontology,14A: Language Generation #6,long.502,https://aclanthology.org/2021.acl-long.502,,,English,BLEU,METEOR,0,0,0,0
BERTGen: Multi-task Generation through BERT,14A: Language Generation #7,long.503,https://aclanthology.org/2021.acl-long.503,,,"English, French, Turkish, German",BLEU,METEOR,1,0,0,0
Selective Knowledge Distillation for Neural Machine Translation,14B: Machine Translation and Multilinguality #9,long.504,https://aclanthology.org/2021.acl-long.504,,,"Chinese, German",BLEU,,0,0,1,0
Measuring and Increasing Context Usage in Context-Aware Machine Translation,14B: Machine Translation and Multilinguality #10,long.505,https://aclanthology.org/2021.acl-long.505,,,"German, French",BLEU,COMET,0,0,0,0
Beyond Offline Mapping: Learning Cross-lingual Word Embeddings through Context Anchoring,14B: Machine Translation and Multilinguality #11,long.506,https://aclanthology.org/2021.acl-long.506,,,Multiple (7),P@1,,1,0,0,0
CCMatrix: Mining Billions of High-Quality Parallel Sentences on the Web,14B: Machine Translation and Multilinguality #12,long.507,https://aclanthology.org/2021.acl-long.507,,,Multiple (>10),BLEU,,1,0,0,0
