Name,Session,ID,URL,Dataset,Domain,Language(s),Main metric,Other metrics,Multilingual?,Fairness or bias?,Efficiency?,Interpretability?
Hierarchical Context-aware Network for Dense Video Event Captioning,"5B: Language Grounding to Vision, Robotics and Beyond #2",long.156,https://aclanthology.org/2021.acl-long.156,,,English,BLEU,Multiple,0,0,0,1
Control Image Captioning Spatially and Temporally,"5B: Language Grounding to Vision, Robotics and Beyond #3",long.157,https://aclanthology.org/2021.acl-long.157,,,English,BLEU,Multiple,0,0,0,0
Edited Media Understanding Frames: Reasoning About the Intent and Implications of Visual Misinformation,"5B: Language Grounding to Vision, Robotics and Beyond #4",long.158,https://aclanthology.org/2021.acl-long.158,,,English,Accuracy,Multiple (automated and human-based),0,0,0,1
PIGLeT: Language Grounding Through Neuro-Symbolic Interaction in a 3D World,"5B: Language Grounding to Vision, Robotics and Beyond #5",long.159,https://aclanthology.org/2021.acl-long.159,,,English,Accuracy,"BLEU, Human-centered, BERTScore",0,0,0,0
Neural Event Semantics for Grounded Language Understanding,"5B: Language Grounding to Vision, Robotics and Beyond #6",TACL,https://direct.mit.edu/tacl/article/doi/10.1162/tacl_a_00402/106993/Neural-Event-Semantics-for-Grounded-Language,,,English,Accuracy,,0,0,0,1
Modeling Fine-Grained Entity Types with Box Embeddings,5C: Machine Learning for NLP #2,long.160,https://aclanthology.org/2021.acl-long.160,,,English,F1,,0,0,0,0
ChineseBERT: Chinese Pretraining Enhanced by Glyph and Pinyin Information,5C: Machine Learning for NLP #3,long.161,https://aclanthology.org/2021.acl-long.161,,,Chinese,Multiple,"Exact match, accuracy, F1",0,0,0,0
Weight Distillation: Transferring the Knowledge in Neural Network Parameters,5C: Machine Learning for NLP #4,long.162,https://aclanthology.org/2021.acl-long.162,,,"English, Romanian, Chinese, German",BLEU,,1,0,1,0
Optimizing Deeper Transformers on Small Datasets,5C: Machine Learning for NLP #5,long.163,https://aclanthology.org/2021.acl-long.163,,,English,Accuracy,,0,0,1,0
BERTAC: Enhancing Transformer-based Language Models with Adversarially Pretrained Convolutional Neural Networks,5C: Machine Learning for NLP #6,long.164,https://aclanthology.org/2021.acl-long.164,,,English,Multiple,,0,0,0,0
On Orthogonality Constraints for Transformers,5C: Machine Learning for NLP #7,short.48,https://aclanthology.org/2021.acl-short.48,,,Multiple (7),BLEU,,1,0,0,0
COVID-Fact: Fact Extraction and Verification of Real-World Claims on COVID-19 Pandemic,5D: NLP Applications #1 and Ethics #2,long.165,https://aclanthology.org/2021.acl-long.165,,,English,"Accuracy, F1",,0,1,0,0
Explaining Relationships Between Scientific Documents,5D: NLP Applications #1 and Ethics #3,long.166,https://aclanthology.org/2021.acl-long.166,,,English,BLEU,"Rouge, Human",0,0,0,0
IrEne: Interpretable Energy Prediction for Transformers,5D: NLP Applications #1 and Ethics #4,long.167,https://aclanthology.org/2021.acl-long.167,,,English,Energy Predition Error,,0,0,1,0
Mitigating Bias in Session-based Cyberbullying Detection: A Non-Compromising Approach,5D: NLP Applications #1 and Ethics #5,long.168,https://aclanthology.org/2021.acl-long.168,,,English,"F1, AUC","FPED, FNED",0,1,0,0
PlotCoder: Hierarchical Decoding for Synthesizing Visualization Code in Programmatic Context,5D: NLP Applications #1 and Ethics #6,long.169,https://aclanthology.org/2021.acl-long.169,,,Programming,Accuracy,,0,0,0,0
Changing the World by Changing the Data,5D: NLP Applications #1 and Ethics #7,long.170,https://aclanthology.org/2021.acl-long.170,,,None,None,,0,1,0,0
EarlyBERT: Efﬁcient BERT Training via Early-bird Lottery Tickets,6A: Machine Learning for NLP #3,long.171,https://aclanthology.org/2021.acl-long.171,,,English,Multiple,,0,0,1,0
On the Effectiveness of Adapter-based Tuning for Pretrained Language Model Adaptation,6A: Machine Learning for NLP #4,long.172,https://aclanthology.org/2021.acl-long.172,,,Multiple (40),Multiple,,1,0,1,0
Data Augmentation for Text Generation Without Any Augmented Data,6A: Machine Learning for NLP #5,long.173,https://aclanthology.org/2021.acl-long.173,,,Multiple (5),BLEU,Perplexity,1,0,1,0
KEPLER: A Unified Model for Knowledge Embedding and Pre-trained Language Representation,6A: Machine Learning for NLP #6,TACL,https://arxiv.org/abs/1911.06136,,,English,F1,Accuracy,0,0,1,0
Integrating Semantics and Neighborhood Information with Graph-Driven Generative Models for Document Retrieval,6A: Machine Learning for NLP #7,long.174,https://aclanthology.org/2021.acl-long.174,,,English,Precision,,0,0,1,0
Measuring and Improving BERT's Mathematical Abilities by Predicting the Order of Reasoning.,6A: Machine Learning for NLP #8,short.49,https://aclanthology.org/2021.acl-short.49,,,English,Accuracy,,0,0,0,0
SMURF: SeMantic and linguistic UndeRstanding Fusion for Caption Evaluation via Typicality Analysis,6B: Resources and Evaluation #1,long.175,https://aclanthology.org/2021.acl-long.175,,,English,Multiple correlation-based,,0,0,0,1
KaggleDBQA: Realistic Evaluation of Text-to-SQL Parsers,6B: Resources and Evaluation #2,long.176,https://aclanthology.org/2021.acl-long.176,,,English,Accuracy,,0,0,0,0
QASR: QCRI Aljazeera Speech Resource A Large Scale Annotated Arabic Speech Corpus,6B: Resources and Evaluation #3,long.177,https://aclanthology.org/2021.acl-long.177,,,Arabic,F1,WER,0,0,0,0
An Empirical Study on Hyperparameter Optimization for Fine-Tuning Pre-trained Language Models,6B: Resources and Evaluation #4,long.178,https://aclanthology.org/2021.acl-long.178,,,English,"Accuracy, F1",,0,0,1,0
Better than Average: Paired Evaluation of NLP systems,6B: Resources and Evaluation #5,long.179,https://aclanthology.org/2021.acl-long.179,,,Multiple,Multiple,,1,0,0,0
"Happy Dance, Slow Clap: Using Reaction GIFs to Predict Induced Affect on Twitter",6B: Resources and Evaluation #6,short.50,https://aclanthology.org/2021.acl-short.50,,,English,Accuracy,"F1, LRAP",0,0,0,0
Chase: A Large-Scale and Pragmatic Chinese Dataset for Cross-Database Context-Dependent Text-to-SQL,"6C: Semantics: Sentence-level Semantics, Textual Inference and Other areas #1",long.180,https://aclanthology.org/2021.acl-long.180,,,Chinese,Question Match,Interaction Match,0,0,0,0
CLINE: Contrastive Learning with Semantic Negative Examples for Natural Language Understanding,"6C: Semantics: Sentence-level Semantics, Textual Inference and Other areas #2",long.181,https://aclanthology.org/2021.acl-long.181,,,English,Accuracy,,0,0,0,0
Tree-Structured Topic Modeling with Nonparametric Neural Variational Inference,"6C: Semantics: Sentence-level Semantics, Textual Inference and Other areas #3",long.182,https://aclanthology.org/2021.acl-long.182,,,English,NPMI,Hierarchical affinity,0,0,0,1
ExCAR: Event Graph Knowledge Enhanced Explainable Causal Reasoning,"6C: Semantics: Sentence-level Semantics, Textual Inference and Other areas #4",long.183,https://aclanthology.org/2021.acl-long.183,,,English,Accuracy,,0,0,0,1
Infusing Finetuning with Semantic Dependencies,"6C: Semantics: Sentence-level Semantics, Textual Inference and Other areas #5",TACL,https://arxiv.org/abs/2012.05395,,,English,Multiple,"LEM, UEM",0,0,0,1
Exploring Listwise Evidence Reasoning with T5 for Fact Verification,"6C: Semantics: Sentence-level Semantics, Textual Inference and Other areas #6",short.51,https://aclanthology.org/2021.acl-short.51,,,English,Accuracy,"Fever score (FS), F1, MAP",0,0,0,0
Distributed Representations of Emotion Categories in Emotion Space,"6D: Sentiment Analysis, Stylistic Analysis, and Argument Mining #2",long.184,https://aclanthology.org/2021.acl-long.184,,,English,Pearson,,0,0,0,0
Style is NOT a single variable: Case Studies for Cross-Stylistic Language Understanding,"6D: Sentiment Analysis, Stylistic Analysis, and Argument Mining #3",long.185,https://aclanthology.org/2021.acl-long.185,,,English,F1,,0,0,0,1
DynaSent: A Dynamic Benchmark for Sentiment Analysis,"6D: Sentiment Analysis, Stylistic Analysis, and Argument Mining #4",long.186,https://aclanthology.org/2021.acl-long.186,,,English,F1,,0,0,1,0
A Hierarchical VAE for Calibrating Attributes while Generating Text using Normalizing Flow,"6D: Sentiment Analysis, Stylistic Analysis, and Argument Mining #5",long.187,https://aclanthology.org/2021.acl-long.187,,,English,Accuracy,Attribute polarity,0,0,0,0
A Unified Generative Framework for Aspect-based Sentiment Analysis,"6D: Sentiment Analysis, Stylistic Analysis, and Argument Mining #6",long.188,https://aclanthology.org/2021.acl-long.188,,,English,F1,,0,0,0,0
Classifying Argumentative Relations Using Logical Mechanisms and Argumentation Schemes,"6D: Sentiment Analysis, Stylistic Analysis, and Argument Mining #7",TACL,https://arxiv.org/abs/2105.07571,,,English,"Accuracy, F1",,0,0,0,0
Discovering Dialogue Slots with Weak Supervision,7A: Dialog and Interactive Systems #4,long.189,https://aclanthology.org/2021.acl-long.189,,,English,F1,"Accuracy, Multiple",0,0,0,0
Enhancing the generalization for Intent Classification and Out-of-Domain Detection in SLU,7A: Dialog and Interactive Systems #5,long.190,https://aclanthology.org/2021.acl-long.190,,,English,Multiple,,0,0,0,0
ProtAugment: Intent Detection Meta-Learning through Unsupervised Diverse Paraphrasing,7A: Dialog and Interactive Systems #6,long.191,https://aclanthology.org/2021.acl-long.191,,,English,Accuracy,,0,0,1,0
Robustness Testing of Language Understanding in Task-Oriented Dialog,7A: Dialog and Interactive Systems #7,long.192,https://aclanthology.org/2021.acl-long.192,,,English,F1,Multiple,0,0,0,0
Comprehensive Study: How the Context Information of Different Granularity Affects Dialogue State Tracking?,7A: Dialog and Interactive Systems #8,long.193,https://aclanthology.org/2021.acl-long.193,,,English,Accuracy,,0,0,1,0
OTTers: One-turn Topic Transitions for Open-Domain Dialogue,7A: Dialog and Interactive Systems #9,long.194,https://aclanthology.org/2021.acl-long.194,,,English,BLEU,Multiple,0,0,0,0
Towards Robustness of Text-to-SQL Models against Synonym Substitution,"7B: Semantics: Sentence-level Semantics, Textual Inference and Other areas #2",long.195,https://aclanthology.org/2021.acl-long.195,,,English,Accuracy,,0,0,0,0
KACE: Generating Knowledge Aware Contrastive Explanations for Natural Language Inference,"7B: Semantics: Sentence-level Semantics, Textual Inference and Other areas #3",long.196,https://aclanthology.org/2021.acl-long.196,,,English,Accuracy,,0,0,0,1
Self-Guided Contrastive Learning for BERT Sentence Representations,"7B: Semantics: Sentence-level Semantics, Textual Inference and Other areas #4",long.197,https://aclanthology.org/2021.acl-long.197,,,"English, Spanish, Arabic",Multiple,,1,0,1,0
LGESQL: Line Graph Enhanced Text-to-SQL Model with Mixed Local and Non-Local Relations,"7B: Semantics: Sentence-level Semantics, Textual Inference and Other areas #5",long.198,https://aclanthology.org/2021.acl-long.198,,,English,Accuracy,,0,0,0,0
DefSent: Sentence Embeddings using Definition Sentences,"7B: Semantics: Sentence-level Semantics, Textual Inference and Other areas #6",short.52,https://aclanthology.org/2021.acl-short.52,,,English,Accuracy,Spearman's rho,0,0,0,0
Discrete Cosine Transform as Universal Sentence Encoder,"7B: Semantics: Sentence-level Semantics, Textual Inference and Other areas #7",short.53,https://aclanthology.org/2021.acl-short.53,,,Multiple (6),Accuracy,,1,0,0,0
Multi-stage Pre-training over Simplified Multimodal Pre-training Models,7C: Speech and Multimodality #1,long.199,https://aclanthology.org/2021.acl-long.199,,,English,Accuracy,,0,0,0,0
Beyond Sentence-Level End-to-End Speech Translation: Context Helps,7C: Speech and Multimodality #2,long.200,https://aclanthology.org/2021.acl-long.200,,,Multiple (9),BLEU,"APT, Accuracy",1,0,0,0
LayoutLMv2: Multi-modal Pre-training for Visually-rich Document Understanding,7C: Speech and Multimodality #3,long.201,https://aclanthology.org/2021.acl-long.201,,,English,Accuracy,"F1, ANLS",0,0,0,0
UNIMO: Towards Unified-Modal Understanding and Generation via Cross-Modal Contrastive Learning,7C: Speech and Multimodality #4,long.202,https://aclanthology.org/2021.acl-long.202,,,English,Multiple,,0,0,0,0
Missing Modality Imagination Network for Emotion Recognition with Uncertain Missing Modalities,7C: Speech and Multimodality #5,long.203,https://aclanthology.org/2021.acl-long.203,,,English,Accuracy,,0,0,0,0
Stacked Acoustic-and-Textual Encoding: Integrating the Pre-trained Models into Speech Translation Encoders,7C: Speech and Multimodality #6,long.204,https://aclanthology.org/2021.acl-long.204,,,"English, German, French",BLEU,,0,0,0,0
N-ary Constituent Tree Parsing with Recursive Semi-Markov Model,"7D: Syntax: Tagging, Chunking, and Parsing #1",long.205,https://aclanthology.org/2021.acl-long.205,,,English,F1,,0,0,1,0
Automated Concatenation of Embeddings for Structured Prediction,"7D: Syntax: Tagging, Chunking, and Parsing #2",long.206,https://aclanthology.org/2021.acl-long.206,,,Multiple (4),F1,"Accuracy, UAS, LAS",1,0,0,0
Multi-View Cross-Lingual Structured Prediction with Minimum Supervision,"7D: Syntax: Tagging, Chunking, and Parsing #3",long.207,https://aclanthology.org/2021.acl-long.207,,,Multiple (10),F1,"Accuracy, UAS, LAS",1,0,1,0
The Limitations of Limited Context for Constituency Parsing,"7D: Syntax: Tagging, Chunking, and Parsing #4",long.208,https://aclanthology.org/2021.acl-long.208,,,None,None,,0,0,0,0
Neural Bi-Lexicalized PCFG Induction,"7D: Syntax: Tagging, Chunking, and Parsing #5",long.209,https://aclanthology.org/2021.acl-long.209,,,English,F1,"LAS, UAS",0,0,0,0
Ruddit: Norms of Offensiveness for English Reddit Comments,7E: Resources and Evaluation #2,long.210,https://aclanthology.org/2021.acl-long.210,,,English,Pearson's rho,MSE,0,1,0,0
Towards Quantifiable Dialogue Coherence Evaluation,7E: Resources and Evaluation #3,long.211,https://aclanthology.org/2021.acl-long.211,,,English,BLEU,Multiple,0,0,1,0
Assessing the Representations of Idiomaticity in Vector Models with a Noun Compound Dataset Labeled at Type and Token Levels,7E: Resources and Evaluation #4,long.212,https://aclanthology.org/2021.acl-long.212,,,"English, Portuguese",Spearman's rho,,0,0,0,0
Factoring Statutory Reasoning as Language Understanding Challenges,7E: Resources and Evaluation #5,long.213,https://aclanthology.org/2021.acl-long.213,,,English,F1,,0,0,0,0
Evaluating Evaluation Measures for Ordinal Classification and Ordinal Quantification,7E: Resources and Evaluation #6,long.214,https://aclanthology.org/2021.acl-long.214,,,English,Multiple,,0,0,0,0
AligNarr: Aligning Narratives on Movies,7E: Resources and Evaluation #7,short.54,https://aclanthology.org/2021.acl-short.54,,,English,F1,,0,0,0,0
Interpretable and Low-Resource Entity Matching via Decoupling Feature Learning from Decision Making,8A: Information Extraction #4,long.215,https://aclanthology.org/2021.acl-long.215,,,English,F1,,0,0,1,1
Locate and Label: A Two-stage Identifier for Nested Named Entity Recognition,8A: Information Extraction #5,long.216,https://aclanthology.org/2021.acl-long.216,,,English,F1,,0,0,0,0
Text2Event: Controllable Sequence-to-Structure Generation for End-to-end Event Extraction,8A: Information Extraction #6,long.217,https://aclanthology.org/2021.acl-long.217,,,English,F1,,0,0,0,0
A Large-Scale Chinese Multimodal NER Dataset with Speech Clues,8A: Information Extraction #7,long.218,https://aclanthology.org/2021.acl-long.218,,,Chinese,F1,,0,0,0,0
A Neural Transition-based Joint Model for Disease Named Entity Recognition and Normalization,8A: Information Extraction #8,long.219,https://aclanthology.org/2021.acl-long.219,,,English,F1,,0,0,0,0
OntoED: Low-resource Event Detection with Ontology Embedding,8A: Information Extraction #9,long.220,https://aclanthology.org/2021.acl-long.220,,,English,F1,,0,0,1,0
Self-Training Sampling with Monolingual Data Uncertainty for Neural Machine Translation,8B: Machine Translation and Multilinguality #4,long.221,https://aclanthology.org/2021.acl-long.221,,,"English, German, Chinese",BLEU,,0,0,0,0
Breaking the Corpus Bottleneck for Context-Aware Neural Machine Translation with Cross-Task Pre-training,8B: Machine Translation and Multilinguality #5,long.222,https://aclanthology.org/2021.acl-long.222,,,"English, German, Chinese",BLEU,METEOR,0,0,0,0
Guiding Teacher Forcing with Seer Forcing for Neural Machine Translation,8B: Machine Translation and Multilinguality #6,long.223,https://aclanthology.org/2021.acl-long.223,,,"Chinese, English, German, Romanian",BLEU,,1,0,0,0
Cascade versus Direct Speech Translation: Do the Differences Still Make a Difference?,8B: Machine Translation and Multilinguality #7,long.224,https://aclanthology.org/2021.acl-long.224,,,"English, German, Spanish, Italian",BLEU,TER,1,0,0,0
Unsupervised Neural Machine Translation for Low-Resource Domains via Meta-Learning,8B: Machine Translation and Multilinguality #8,long.225,https://aclanthology.org/2021.acl-long.225,,,"English, German",BLEU,,0,0,0,0
An Exploratory Analysis of Multilingual Word-Level Quality Estimation with Cross-Lingual Transformers,8B: Machine Translation and Multilinguality #9,short.55,https://aclanthology.org/2021.acl-short.55,,,Multiple (6),F1,,1,0,0,0
Lightweight Cross-Lingual Sentence Representation Learning,8C: Machine Learning for NLP #4,long.226,https://aclanthology.org/2021.acl-long.226,,,Multiple (5),Accuracy,,1,0,1,0
ERNIE-Doc: A Retrospective Long-Document Modeling Transformer,8C: Machine Learning for NLP #5,long.227,https://aclanthology.org/2021.acl-long.227,,,"English, German",Multiple,,0,0,1,0
Marginal Utility Diminishes: Exploring the Minimum Knowledge for BERT Knowledge Distillation,8C: Machine Learning for NLP #6,long.228,https://aclanthology.org/2021.acl-long.228,,,English,Multiple,,0,0,1,0
Rational LAMOL: A Rationale-based Lifelong Learning Framework,8C: Machine Learning for NLP #7,long.229,https://aclanthology.org/2021.acl-long.229,,,English,Accuracy,,0,0,0,1
EnsLM: Ensemble Language Model for Data Diversity by Semantic Clustering,8C: Machine Learning for NLP #8,long.230,https://aclanthology.org/2021.acl-long.230,,,English,Accuracy,Mutual information,0,0,0,0
LeeBERT: Learned Early Exit for BERT with cross-level optimization,8C: Machine Learning for NLP #9,long.231,https://aclanthology.org/2021.acl-long.231,,,English,Multiple,,0,0,1,0
Unsupervised Extractive Summarization-Based Representations for Accurate and Explainable Collaborative Filtering,8D: NLP Applications #2,long.232,https://aclanthology.org/2021.acl-long.232,,,"English, German, Chinese",Accuracy,BLEU,0,0,0,0
PLOME: Pre-training with Misspelled Knowledge for Chinese Spelling Correction,8D: NLP Applications #3,long.233,https://aclanthology.org/2021.acl-long.233,,,Chinese,"Accuracy, F1",,0,0,1,0
Competence-based Multimodal Curriculum Learning for Medical Report Generation,8D: NLP Applications #4,long.234,https://aclanthology.org/2021.acl-long.234,,,English,Multiple,,0,0,0,0
Learning Syntactic Dense Embedding with Correlation Graph for Automatic Readability Assessment,8D: NLP Applications #5,long.235,https://aclanthology.org/2021.acl-long.235,,,English,Accuracy,,0,0,0,0
Meta-KD: A Meta Knowledge Distillation Framework for Language Model Compression across Domains,8D: NLP Applications #6,long.236,https://aclanthology.org/2021.acl-long.236,,,English,Accuracy,,0,0,1,0
Exploration and Exploitation: Two Ways to Improve Chinese Spelling Correction Models,8D: NLP Applications #7,short.56,https://aclanthology.org/2021.acl-short.56,,,Chinese,F1,,0,0,0,0
A Semantic-based Method for Unsupervised Commonsense Question Answering,8E: Question Answering #1,long.237,https://aclanthology.org/2021.acl-long.237,,,English,Accuracy,"Semantic similarity, attack success rate",0,0,0,0
Explanations for CommonsenseQA: New Dataset and Models,8E: Question Answering #2,long.238,https://aclanthology.org/2021.acl-long.238,,,English,F1,,0,0,0,1
Few-Shot Question Answering by Pretraining Span Selection,8E: Question Answering #3,long.239,https://aclanthology.org/2021.acl-long.239,,,English,F1,,0,0,0,0
UnitedQA: A Hybrid Approach for Open Domain Question Answering,8E: Question Answering #4,long.240,https://aclanthology.org/2021.acl-long.240,,,English,Exact match,,0,0,0,0
Database reasoning over text,8E: Question Answering #5,long.241,https://aclanthology.org/2021.acl-long.241,,,English,Accuracy,,0,0,1,0
Training Adaptive Computation for Open-Domain Question Answering with Computational Constraints,8E: Question Answering #6,short.57,https://aclanthology.org/2021.acl-short.57,,,English,Exact match,Top-k retrieval accuracy,0,0,0,0
Online Learning Meets Machine Translation Evaluation: Finding the Best Systems with the Least Human Effort,9A: Machine Translation and Multilinguality #5,long.242,https://aclanthology.org/2021.acl-long.242,,,Multiple (6),Overlap ratio,Average z-score,1,0,0,0
How Good is Your Tokenizer? On the Monolingual Performance of Multilingual Language Models,9A: Machine Translation and Multilinguality #6,long.243,https://aclanthology.org/2021.acl-long.243,,,Multiple (9),"Accuracy, F1, EM, UAS/LAS",,1,0,0,0
Evaluating morphological typology in zero-shot cross-lingual transfer,9A: Machine Translation and Multilinguality #7,long.244,https://aclanthology.org/2021.acl-long.244,,,Multiple (>10),"Accuracy, F1",,1,0,0,0
From Machine Translation to Code-Switching: Generating High-Quality Code-Switched Text,9A: Machine Translation and Multilinguality #8,long.245,https://aclanthology.org/2021.acl-long.245,,,"Hindi, Spanish",BLEU,"Perplexity, Accuracy, F1",0,0,0,0
Fast and Accurate Neural Machine Translation with Translation Memory,9A: Machine Translation and Multilinguality #9,long.246,https://aclanthology.org/2021.acl-long.246,,,Multiple (5),BLEU,,1,0,1,0
An Empirical Study on Adversarial Attack on NMT: Languages and Positions Matter,9A: Machine Translation and Multilinguality #10,short.58,https://aclanthology.org/2021.acl-short.58,,,"Japanese, Chinese",BLEU,BERTScore,0,0,0,1
Annotating Online Misogyny,9B: Resources and Evaluation #3,long.247,https://aclanthology.org/2021.acl-long.247,,,Multiple (7),F1,,1,1,0,0
Few-NERD: A Few-shot Named Entity Recognition Dataset,9B: Resources and Evaluation #4,long.248,https://aclanthology.org/2021.acl-long.248,,,English,F1,,0,0,0,0
MultiMET: A Multimodal Dataset for Metaphor Understanding,9B: Resources and Evaluation #5,long.249,https://aclanthology.org/2021.acl-long.249,,,English,Accuracy,,0,0,0,0
Human-in-the-Loop for Data Collection: a Multi-Target Counter Narrative Dataset to Fight Online Hate Speech,9B: Resources and Evaluation #6,long.250,https://aclanthology.org/2021.acl-long.250,,,English,"Multiple customised ones (HTER, Novelty, etc)",,0,0,0,1
OntoGUM: Evaluating Contextualized SOTA Coreference Resolution on 12 More Genres,9B: Resources and Evaluation #7,short.59,https://aclanthology.org/2021.acl-short.59,,,English,F1,,0,0,0,0
Can Generative Pre-trained Language Models Serve As Knowledge Bases for Closed-book QA?,9C: Question Answering #2,long.251,https://aclanthology.org/2021.acl-long.251,,,English,Exact match,F1,0,0,0,0
Joint Models for Answer Verification in Question Answering Systems,9C: Question Answering #3,long.252,https://aclanthology.org/2021.acl-long.252,,,English,"P@1, MRR, MAP",,0,0,0,0
Answering Ambiguous Questions through Generative Evidence Fusion and Round-Trip Prediction,9C: Question Answering #4,long.253,https://aclanthology.org/2021.acl-long.253,,,English,F1,,0,0,0,0
TAT-QA: A Question Answering Benchmark on a Hybrid of Tabular and Textual Content in Finance,9C: Question Answering #5,long.254,https://aclanthology.org/2021.acl-long.254,,,English,Exact match,F1,0,0,0,0
Modeling Transitions of Focal Entities for Conversational Knowledge Base Question Answering,9C: Question Answering #6,long.255,https://aclanthology.org/2021.acl-long.255,,,English,"Accuracy, F1",,0,0,0,0
In Factuality: Efficient Integration of Relevant Facts for Visual Question Answering,9C: Question Answering #7,short.60,https://aclanthology.org/2021.acl-short.60,,,English,Accuracy,,0,1,0,0
Evidence-based Factual Error Correction,"9D: Semantics: Sentence-level Semantics, Textual Inference and Other areas #3",long.256,https://aclanthology.org/2021.acl-long.256,,,English,Multiple,,0,0,0,0
"Probabilistic, Structure-Aware Algorithms for Improved Variety, Accuracy, and Coverage of AMR Alignments","9D: Semantics: Sentence-level Semantics, Textual Inference and Other areas #4",long.257,https://aclanthology.org/2021.acl-long.257,,,English,F1,,0,0,0,0
Meta-Learning to Compositionally Generalize,"9D: Semantics: Sentence-level Semantics, Textual Inference and Other areas #5",long.258,https://aclanthology.org/2021.acl-long.258,,,English,Accuracy,,0,0,0,0
Taming Pre-trained Language Models with N-gram Representations for Low-Resource Domain Adaptation,"9D: Semantics: Sentence-level Semantics, Textual Inference and Other areas #6",long.259,https://aclanthology.org/2021.acl-long.259,,,English,F1,,0,0,0,0
ERICA: Improving Entity and Relation Understanding for Pre-trained Language Models via Contrastive Learning,"9D: Semantics: Sentence-level Semantics, Textual Inference and Other areas #7",long.260,https://aclanthology.org/2021.acl-long.260,,,English,"Accuracy, F1",,0,0,0,0
Zero-shot Fact Verification by Claim Generation,"9D: Semantics: Sentence-level Semantics, Textual Inference and Other areas #8",short.61,https://aclanthology.org/2021.acl-short.61,,,English,F1,,0,0,0,0
Position Bias Mitigation: A Knowledge-Aware Graph Model for Emotion Cause Extraction,"9E: Sentiment Analysis, Stylistic Analysis, and Argument Mining #3",long.261,https://aclanthology.org/2021.acl-long.261,,,English,F1,,0,0,0,1
