Name,Session,ID,URL,Dataset,Domain,Language(s),Main metric,Other metrics,Multilingual?,Fairness or bias?,Efficiency?,Interpretability?
EDITOR: an Edit-Based Transformer with Repositioning for Neural Machine Translation with Soft Lexical Constraints,14B: Machine Translation and Multilinguality #13,TACL,https://direct.mit.edu/tacl/article/doi/10.1162/tacl_a_00368/98622/EDITOR-An-Edit-Based-Transformer-with,,,"Romanian, German, Japanese (and English)",BLEU,RIBES,0,0,0,0
Gender Bias in Machine Translation,14B: Machine Translation and Multilinguality #14,TACL,https://direct.mit.edu/tacl/article/doi/10.1162/tacl_a_00401/106991/Gender-Bias-in-Machine-Translation,,,None,None,,0,1,0,0
"Length-Adaptive Transformer: Train Once with Length Drop, Use Anytime with Search",14C: Machine Learning for NLP #7,long.508,https://aclanthology.org/2021.acl-long.508,,,English,"Accuracy, F1",,0,0,1,0
GhostBERT: Generate More Features with Cheap Operations for BERT,14C: Machine Learning for NLP #8,long.509,https://aclanthology.org/2021.acl-long.509,,,English,"Accuracy, F1",,0,0,1,0
Super Tickets in Pre-Trained Language Models: From Model Compression to Improving Generalization,14C: Machine Learning for NLP #9,long.510,https://aclanthology.org/2021.acl-long.510,,,English,"Accuracy, F1",,0,0,1,0
A Novel Estimator of Mutual Information for Learning to Disentangle Textual Representations,14C: Machine Learning for NLP #10,long.511,https://aclanthology.org/2021.acl-long.511,,,English,Accuracy,,0,1,0,0
Determinantal Beam Search,14C: Machine Learning for NLP #11,long.512,https://aclanthology.org/2021.acl-long.512,,,"French, German",BLEU,,0,0,0,0
Multi-hop Graph Convolutional Network with High-order Chebyshev Approximation for Text Reasoning,14C: Machine Learning for NLP #12,long.513,https://aclanthology.org/2021.acl-long.513,,,English,"Accuracy, F1",,0,0,0,0
Accelerating Text Communication via Abbreviated Sentence Input,14D: NLP Applications #4,long.514,https://aclanthology.org/2021.acl-long.514,,,English,Words per minute,CER,0,0,1,0
"Regression Bugs Are In Your Model! Measuring, Reducing and Analyzing Regressions In NLP Model Updates",14D: NLP Applications #5,long.515,https://aclanthology.org/2021.acl-long.515,,,English,Accuracy,,0,0,0,1
Detecting Propaganda Techniques in Memes,14D: NLP Applications #6,long.516,https://aclanthology.org/2021.acl-long.516,,,English,F1,F1-Macro,0,0,0,0
Unsupervised Cross-Domain Prerequisite Chain Learning using Variational Graph Autoencoders,14D: NLP Applications #7,short.127,https://aclanthology.org/2021.acl-short.127,,,English,"Accuracy, F1",,0,0,0,0
Attentive Multiview Text Representation for Differential Diagnosis,14D: NLP Applications #8,short.128,https://aclanthology.org/2021.acl-short.128,,,English,MAP,p@k,0,0,0,0
MedNLI Is Not Immune: Natural Language Inference Artifacts in the Clinical Domain,14D: NLP Applications #9,short.129,https://aclanthology.org/2021.acl-short.129,,,English,Accuracy,,0,0,0,1
On the Efficacy of Adversarial Data Collection for Question Answering: Results from a Large-Scale Randomized Study,14E: Question Answering #4,long.517,https://aclanthology.org/2021.acl-long.517,,,English,Exact match,F1,0,0,0,0
Learning Dense Representations of Phrases at Scale,14E: Question Answering #5,long.518,https://aclanthology.org/2021.acl-long.518,,,English,Exact match,F1,0,0,0,0
End-to-End Training of Neural Retrievers for Open-Domain Question Answering,14E: Question Answering #6,long.519,https://aclanthology.org/2021.acl-long.519,,,English,Top-k retrieval accuracy,,0,0,0,0
Question Answering Over Temporal Knowledge Graphs,14E: Question Answering #7,long.520,https://aclanthology.org/2021.acl-long.520,,,English,Hits@1,Hits@10,0,0,0,0
Towards a more Robust Evaluation for Conversational Question Answering,14E: Question Answering #8,short.130,https://aclanthology.org/2021.acl-short.130,,,English,F1,,0,0,0,0
VAULT: VAriable Unified Long Text Representation for Machine Reading Comprehension,14E: Question Answering #9,short.131,https://aclanthology.org/2021.acl-short.131,,,English,F1,,0,0,0,0
Language Model Augmented Relevance Score,15A: Language Generation #3,long.521,https://aclanthology.org/2021.acl-long.521,,,English,Pearson's rho,Many,0,0,0,1
DExperts: Decoding-Time Controlled Text Generation with Experts and Anti-Experts,15A: Language Generation #4,long.522,https://aclanthology.org/2021.acl-long.522,,,English,Toxicity,,0,1,1,0
"Polyjuice: Generating Counterfactuals for Explaining, Evaluating, and Improving Models",15A: Language Generation #5,long.523,https://aclanthology.org/2021.acl-long.523,,,English,Diversity ,Closeness,0,0,0,1
Metaphor Generation with Conceptual Mappings,15A: Language Generation #6,long.524,https://aclanthology.org/2021.acl-long.524,,,English,Human,Distance,0,0,0,0
Computational Framework for Slang Generation,15A: Language Generation #7,TACL,https://direct.mit.edu/tacl/article/doi/10.1162/tacl_a_00378/100687/A-Computational-Framework-for-Slang-Generation,,,English,AUC,,0,0,0,0
Avoiding Overlap in Data Augmentation for AMR-to-Text Generation,15A: Language Generation #8,short.132,https://aclanthology.org/2021.acl-short.132,,,English,BLEU,,0,0,0,0
Learning Latent Structures for Cross Action Phrase Relations in Wet Lab Protocols,15B: NLP Applications #5,long.525,https://aclanthology.org/2021.acl-long.525,,,English,F1,,0,0,0,0
"Multimodal Multi-Speaker Merger & Acquisition Financial Modeling: A New Task, Dataset, and Neural Baselines",15B: NLP Applications #6,long.526,https://aclanthology.org/2021.acl-long.526,,,English,MSE,F1,0,0,0,0
Mid-Air Hand Gestures for Post-Editing of Machine Translation,15B: NLP Applications #7,long.527,https://aclanthology.org/2021.acl-long.527,,,German,Likert ratings,,0,0,0,0
Inter-GPS: Interpretable Geometry Problem Solving with Formal Language and Symbolic Reasoning,15B: NLP Applications #8,long.528,https://aclanthology.org/2021.acl-long.528,,,English,Accuracy,,0,0,0,0
Joint Verification and Reranking for Open Fact Checking Over Tables,15B: NLP Applications #9,long.529,https://aclanthology.org/2021.acl-long.529,,,English,Accuracy,H@k,0,0,0,0
Weakly-Supervised Methods for Suicide Risk Assessment: Role of Related Domains,15B: NLP Applications #10,short.133,https://aclanthology.org/2021.acl-short.133,,,English,F1,,0,0,0,0
Evaluation of Thematic Coherence in Microblogs,15C: Resources and Evaluation #5,long.530,https://aclanthology.org/2021.acl-long.530,,,English,Spearman's rho,Pearson's rho,0,0,0,0
Neural semi-Markov CRF for Monolingual Word Alignment,15C: Resources and Evaluation #6,long.531,https://aclanthology.org/2021.acl-long.531,,,English,F1,EM,0,0,0,0
Privacy at Scale: Introducing the PrivaSeer Corpus of Web Privacy Policies,15C: Resources and Evaluation #7,long.532,https://aclanthology.org/2021.acl-long.532,,,English,F1,,0,0,0,0
The statistical advantage of automatic NLG metrics at the system level,15C: Resources and Evaluation #8,long.533,https://aclanthology.org/2021.acl-long.533,,,English ,Pairwise error,,0,0,0,0
Are Missing Links Predictable? An Inferential Benchmark for Knowledge Graph Completion,15C: Resources and Evaluation #9,long.534,https://aclanthology.org/2021.acl-long.534,,,English,Accuracy,F1,0,0,0,0
Can Transformer Models Measure Coherence In Text: Re-Thinking the Shuffle Test,15C: Resources and Evaluation #10,short.134,https://aclanthology.org/2021.acl-short.134,,,English,Accuracy,,0,0,0,1
ConvoSumm: Conversation Summarization Benchmark and Improved Abstractive Summarization with Argument Mining,15D: Summarization #2,long.535,https://aclanthology.org/2021.acl-long.535,,,English,Rouge-1,"Rouge-2, Rouge-L,    ",0,0,0,0
Improving Factual Consistency of Abstractive Summarization via Question Answering,15D: Summarization #3,long.536,https://aclanthology.org/2021.acl-long.536,,,English,Human,"FactCC, Rouge-1, Rouge-L",0,1,0,0
EmailSum: Abstractive Email Thread Summarization,15D: Summarization #4,long.537,https://aclanthology.org/2021.acl-long.537,,,English,Rouge-1,,0,0,0,0
Cross-Lingual Abstractive Summarization with Limited Parallel Resources,15D: Summarization #5,long.538,https://aclanthology.org/2021.acl-long.538,,,"English, Chinese, German",Rouge-1,"Rouge-2, Rouge-L, BERTScore",0,0,0,0
Dissecting Generation Modes for Abstractive Summarization Models via Ablation and Attribution,15D: Summarization #6,long.539,https://aclanthology.org/2021.acl-long.539,,,English,None,,0,0,0,1
SimCLS: A Simple Framework for Contrastive Learning of Abstractive Summarization,15D: Summarization #7,short.135,https://aclanthology.org/2021.acl-short.135,,,English,ROUGE-1,"Rouge-L, ROUGE-2",0,0,0,0
Learning Prototypical Functions for Physical Artifacts,15E: Semantics: Lexical Semantics #2,long.540,https://aclanthology.org/2021.acl-long.540,,,English,"Accuracy, F1",,0,0,0,0
Verb Knowledge Injection for Multilingual Event Processing,15E: Semantics: Lexical Semantics #3,long.541,https://aclanthology.org/2021.acl-long.541,,,"English, Spanish, Arabic, Chinese",F1,,0,0,0,0
Dynamic Contextualized Word Embeddings,15E: Semantics: Lexical Semantics #4,long.542,https://aclanthology.org/2021.acl-long.542,,,English,Perplexity,,0,0,0,0
Lexical Semantic Change Discovery,15E: Semantics: Lexical Semantics #5,long.543,https://aclanthology.org/2021.acl-long.543,,,German,F0.5,,0,0,0,0
Analysis and Evaluation of Language Models for Word Sense Disambiguation,15E: Semantics: Lexical Semantics #6,TACL,https://direct.mit.edu/coli/article/47/2/387/98520/Analysis-and-Evaluation-of-Language-Models-for,,,English,F-Measure,CS,0,0,0,0
Let's Play mono-poly: BERT Can Reveal Words' Degree of Polysemy,15E: Semantics: Lexical Semantics #7,TACL,https://direct.mit.edu/tacl/article/doi/10.1162/tacl_a_00400/106797/Let-s-Play-Mono-Poly-BERT-Can-Reveal-Words,,,"English, French, Spanish, Greek",SelfSim,,1,0,0,0
Pretraining the Noisy Channel Model for Task-Oriented Dialogue,16A: Dialog and Interactive Systems #7,TACL,https://direct.mit.edu/tacl/article/doi/10.1162/tacl_a_00390/102844/Pretraining-the-Noisy-Channel-Model-for-Task,,,English,Accuracy,BLEU,0,0,0,0
The R-U-A-Robot Dataset: Helping Avoid Chatbot Deception by Detecting User Questions About Human or Non-Human Identity,16A: Dialog and Interactive Systems #8,long.544,https://aclanthology.org/2021.acl-long.544,,,English,Accuracy,"Precision, Recall",0,1,0,0
"Conversation Graph: Data Augmentation, Training and Evaluation for Non-Deterministic Dialogue Management",16A: Dialog and Interactive Systems #9,TACL,https://aclanthology.org/2021.tacl-1.3.pdf,,,English,BCE loss,SBCE loss,0,0,0,0
Using Meta-Knowledge Mined from Identifiers to Improve Intent Recognition in Conversational Systems,16A: Dialog and Interactive Systems #10,long.545,https://aclanthology.org/2021.acl-long.545,,,Portuguese,False Acceptance Rate,,0,0,1,0
Space Efficient Context Encoding for Non-Task-Oriented Dialogue Generation with Graph Attention Transformer,16A: Dialog and Interactive Systems #11,long.546,https://aclanthology.org/2021.acl-long.546,,,English,Precision,Perplexity,0,0,1,0
DialogueCRN: Contextual Reasoning Networks for Emotion Recognition in Conversations,16A: Dialog and Interactive Systems #12,long.547,https://aclanthology.org/2021.acl-long.547,,,English,"Accuracy, F1",,0,0,0,0
Cross-replication Reliability - An Empirical Approach to Interpreting Inter-rater Reliability,16B: Resources and Evaluation #6,long.548,https://aclanthology.org/2021.acl-long.548,,,English,Kappa,,0,0,0,0
TIMEDIAL: Temporal Commonsense Reasoning in Dialog,16B: Resources and Evaluation #7,long.549,https://aclanthology.org/2021.acl-long.549,,,English,Accuracy,,0,0,0,0
RAW-C: Relatedness of Ambiguous Words in Context (A New Lexical Resource for English),16B: Resources and Evaluation #8,long.550,https://aclanthology.org/2021.acl-long.550,,,English,Cosine,,0,0,0,0
ARBERT & MARBERT: Deep Bidirectional Transformers for Arabic,16B: Resources and Evaluation #9,long.551,https://aclanthology.org/2021.acl-long.551,,,Arabic,"Accuracy, F1",,0,0,0,0
SaRoCo: Detecting Satire in a Novel Romanian Corpus of News Articles,16B: Resources and Evaluation #10,short.136,https://aclanthology.org/2021.acl-short.136,,,Romanian,"Accuracy, F1",,0,0,0,0
Bringing Structure into Summaries: a Faceted Summarization Dataset for Long Scientific Documents,16B: Resources and Evaluation #11,short.137,https://aclanthology.org/2021.acl-short.137,,,English,Rouge-L,,0,0,0,0
Improving Paraphrase Detection with the Adversarial Paraphrasing Task,"16C: Semantics: Sentence-level Semantics, Textual Inference and Other areas #4",long.552,https://aclanthology.org/2021.acl-long.552,,,English,BLEURT,"MCC, F1",0,0,0,0
ADEPT: An Adjective-Dependent Plausibility Task,"16C: Semantics: Sentence-level Semantics, Textual Inference and Other areas #5",long.553,https://aclanthology.org/2021.acl-long.553,,,English,Accuracy,,0,0,0,0
ReadOnce Transformers: Reusable Representations of Text for Transformers,"16C: Semantics: Sentence-level Semantics, Textual Inference and Other areas #6",long.554,https://aclanthology.org/2021.acl-long.554,,,English,F1,Rouge-L,0,0,0,0
Conditional Generation of Temporally-ordered Event Sequences,"16C: Semantics: Sentence-level Semantics, Textual Inference and Other areas #7",long.555,https://aclanthology.org/2021.acl-long.555,,,English,Accuracy,Exact Match,0,0,0,0
Hate Speech Detection Based on Sentiment Knowledge Sharing,"16C: Semantics: Sentence-level Semantics, Textual Inference and Other areas #8",long.556,https://aclanthology.org/2021.acl-long.556,,,English,"Accuracy, F1",,0,0,0,0
Transition-based Bubble Parsing: Improvements on Coordination Structure Prediction,"16D: Syntax: Tagging, Chunking, and Parsing #2",long.557,https://aclanthology.org/2021.acl-long.557,,,English,F1,Exact Match,0,0,0,0
SpanNER: Named Entity Re-/Recognition as Span Prediction,"16D: Syntax: Tagging, Chunking, and Parsing #3",long.558,https://aclanthology.org/2021.acl-long.558,,,"English, Spanish, Dutch",F1,,0,0,0,0
Strong Equivalence of TAG and CCG,"16D: Syntax: Tagging, Chunking, and Parsing #4",TACL,https://direct.mit.edu/tacl/article/doi/10.1162/tacl_a_00393/106789/Strong-Equivalence-of-TAG-and-CCG,,,None,None,,0,0,0,0
StructFormer: Joint Unsupervised Induction of Dependency and Constituency Structure from Masked Language Modeling,"16D: Syntax: Tagging, Chunking, and Parsing #5",long.559,https://aclanthology.org/2021.acl-long.559,,,English,UAS,,0,0,0,0
"Replicating and Extending Because Their Treebanks Leak'': Graph Isomorphism, Covariants, and Parser Performance","16D: Syntax: Tagging, Chunking, and Parsing #6",short.138,https://aclanthology.org/2021.acl-short.138,,,Multiple (>10),LAS,,1,0,0,1
Language Embeddings for Typology and Cross-lingual Transfer Learning,16E: Machine Translation and Multilinguality #10,long.560,https://aclanthology.org/2021.acl-long.560,,,Multiple (>10),LAS,Accuracy,1,0,0,0
Can Sequence-to-Sequence Models Crack Substitution Ciphers?,16E: Machine Translation and Multilinguality #11,long.561,https://aclanthology.org/2021.acl-long.561,,,Multiple (>10),SER,,1,0,0,0
Beyond Noise: Mitigating the Impact of Fine-grained Semantic Divergences on Neural Machine Translation,16E: Machine Translation and Multilinguality #12,long.562,https://aclanthology.org/2021.acl-long.562,,,French,BLEU,"Meteor, InfECE",0,0,0,1
Revisiting Negation in Neural Machine Translation,16E: Machine Translation and Multilinguality #13,TACL,https://arxiv.org/abs/2107.12203,,,"German, Chinese",Accuracy,,0,0,0,1
Discriminative Reranking for Neural Machine Translation,16E: Machine Translation and Multilinguality #14,long.563,https://aclanthology.org/2021.acl-long.563,,,"German, Tamil, Russian",BLEU,TER,1,0,0,0
Don't Rule Out Monolingual Speakers: A Method For Crowdsourcing Machine Translation Data,16E: Machine Translation and Multilinguality #15,short.139,https://aclanthology.org/2021.acl-short.139,,,"Hindi, Tamil",BLEU,,0,0,1,0
Mind Your Outliers! Investigating the Negative Impact of Outliers on Active Learning for Visual Question Answering,Best Paper Session,long.564,https://aclanthology.org/2021.acl-long.564,,,English,Accuracy,,0,0,1,0
All That's 'Human' Is Not Gold: Evaluating Human Evaluation of Generated Text,Best Paper Session,long.565,https://aclanthology.org/2021.acl-long.565,,,English,Accuracy,,0,0,0,0
Scientific Credibility of Machine Translation Research: A Meta-Evaluation of 769 Papers,Best Paper Session,long.566,https://aclanthology.org/2021.acl-long.566,,,None,None,,0,0,0,0
Neural Machine Translation with Monolingual Translation Memory,Best Paper Session,long.567,https://aclanthology.org/2021.acl-long.567,,,"Spanish, German",BLEU,,0,0,0,0
Intrinsic Dimensionality Explains the Effectiveness of Language Model Fine-Tuning,Best Paper Session,long.568,https://aclanthology.org/2021.acl-long.568,,,English,Accuracy,,0,0,0,1
UnNatural Language Inference,Best Paper Session,long.569,https://aclanthology.org/2021.acl-long.569,,,English,Accuracy,,0,0,0,1
Including Signed Languages in Natural Language Processing,Best Paper Session,long.570,https://aclanthology.org/2021.acl-long.570,,,None,None,,0,0,0,0
Vocabulary Learning via Optimal Transport for Neural Machine Translation,Best Paper Session,long.571,https://aclanthology.org/2021.acl-long.571,,,Multiple (>10),BLEU,,1,0,1,0